true_label0,Abstract,predicted_label0
1,"Amino acid substitution (Ile194----Thr) in exon 5 of the lipoprotein lipase gene causes lipoprotein lipase deficiency in three unrelated probands. Support for a multicentric origin.  Studies on the molecular biology of lipoprotein lipase (LPL) deficiency have been facilitated by the availability of LPL gene probes and the recent characterization of gene mutations underlying human LPL deficiency. Typically, missense mutations have predominated and show a preferential localization to exons 4 and 5. This distribution supports earlier studies attributing functional significance to residues encoded by these exons. We now report a further missense mutation within exon 5 of the LPL gene in three unrelated patients. Amplification of individual exons by the polymerase chain reaction and direct sequencing revealed a T----C transition at codon 194 of the LPL cDNA which results in a substitution of threonine for isoleucine at this residue. The catalytic abnormality induced by this mutation was confirmed through in vitro mutagenesis studies in COS-1 cells. Transfection with a LPL cDNA containing the codon 194 transition resulted in the synthesis and secretion of a catalytically defective protein. The Thr194 substitution was associated with two different DNA haplotypes, consistent with a multicentric origin for this mutation.",0
1,"Identification of the low density lipoprotein receptor-binding site in apolipoprotein B100 and the modulation of its binding activity by the carboxyl terminus in familial defective apo-B100.  Familial defective apolipoprotein B100 (FDB) is caused by a mutation of apo-B100 (R3500Q) that disrupts the receptor binding of low density lipoproteins (LDL), which leads to hypercholesterolemia and premature atherosclerosis. In this study, mutant forms of human apo-B were expressed in transgenic mice, and the resulting human recombinant LDL were purified and tested for their receptor-binding activity. Site-directed mutagenesis and other evidence indicated that Site B (amino acids 3,359-3,369) binds to the LDL receptor and that arginine-3,500 is not directly involved in receptor binding. The carboxyl-terminal 20% of apo-B100 is necessary for the R3500Q mutation to disrupt receptor binding, since removal of the carboxyl terminus in FDB LDL results in normal receptor-binding activity. Similarly, removal of the carboxyl terminus of apo-B100 on receptor-inactive VLDL dramatically increases apo-B-mediated receptor-binding activity. We propose that the carboxyl terminus normally functions to inhibit the interaction of apo-B100 VLDL with the LDL receptor, but after the conversion of triglyceride-rich VLDL to smaller cholesterol-rich LDL, arginine-3,500 interacts with the carboxyl terminus, permitting normal interaction between LDL and its receptor. Moreover, the loss of arginine at this site destabilizes this interaction, resulting in receptor-binding defective LDL.",0
1,"Comparison of the genetic defect with LDL-receptor activity in cultured cells from patients with a clinical diagnosis of heterozygous familial hypercholesterolemia. The Familial Hypercholesterolaemia Regression Study Group.  In this study we have analyzed the genetic defect in 42 patients with a diagnosis of heterozygous familial hypercholesterolemia (FH) by Southern blotting, SSCP, and sequencing of PCR-amplified fragments of genomic DNA or sequencing of RT-PCR products from mRNA in cultured cells. The apoB Arg3500Gln mutation was identified in five patients. A molecular defect in the LDL-receptor gene was confirmed in 23 patients; 16 of these mutations have not been described before. No defect in the coding region, intron:exon junctions or proximal promoter of the LDL-receptor gene or in the region of the apoB gene coding for the LDL-receptor binding domain was found in the remaining 14 patients. LDL-receptor activity and protein content of cultured lymphoblasts from the patients was significantly lower in cells from patients with severe rather than mild LDL-receptor mutations. Cells from four patients with no detectable defect showed reduced LDL receptor activity compared with eight normal cell lines, whereas six others had reduced LDL-receptor activity but LDL-receptor protein content within the normal range. Cells from four patients appeared to have normal LDL-receptor function. Cells from two patients with a defined defect also had LDL-receptor activity within the normal range. The findings demonstrate the problems involved in the genetic diagnosis of FH in patients.",0
1,"Alterations in bile acid synthesis in carriers of hepatocyte nuclear factor 1α mutations.  Heterozygous mutations in hepatocyte nuclear factor 1α (HNF1α) cause maturity onset diabetes of the young 3 (MODY3), an autosomal dominant form of diabetes. Deficiency of HNF1α in mice results in diabetes, hypercholesterolaemia and increased bile acid (BA) and cholesterol synthesis. Little is known about alterations in lipid metabolism in patients with MODY3. The aim of this study was to investigate whether patients with MODY3 have altered cholesterol and BA synthesis and intestinal cholesterol absorption. A secondary aim was to investigate the effects of HNF1α mutations on the transcriptional regulation of BA metabolism. Plasma biomarkers of BA and cholesterol synthesis and intestinal cholesterol absorption were measured in patients with MODY3 (n = 19) and in matched healthy control subjects (n = 15). Cotransfection experiments were performed with several promoters involved in BA metabolism along with expression vectors carrying the mutations found in these patients. Plasma analysis showed higher levels of BA synthesis in patients with MODY3. No differences were observed in cholesterol synthesis or intestinal cholesterol absorption. Cotransfection experiments showed that one of the mutations (P379A) increased the induction of the cholesterol 7α-hydroxylase promoter compared with HNF1α, without further differences in other studied promoters. By contrast, the other four mutations (L107I, T260M, P291fsinsC and R131Q) reduced the induction of the farnesoid X receptor (FXR) promoter, which was followed by reduced repression of the small heterodimer partner promoter. In addition, these mutations also reduced the induction of the apical sodium-dependent bile salt transporter promoter. BA synthesis is increased in patients with MODY3 compared with control subjects. Mutations in HNF1α affect promoters involved in BA metabolism.",0
1,"The genetic spectrum of familial hypercholesterolemia in Pakistan.  Familial hypercholesterolemia (FH) is an autosomal dominant disease caused by mutations in the genes coding for the low density lipoprotein receptor (LDLR), proprotein convertase subtilisin/kexin type-9 (PCSK9) or apo-lipoprotein B-100 (APOB). The aim of the present work was to determine the genetic basis of dyslipidemia in 11 unrelated Pakistani families. High resolution melting (HRM), sequencing and restriction fragment length polymorphism (RFLP). Probands were screened for the promoter and all coding regions, including intron/exon boundaries, of LDLR and PCSK9 and part of exon 26 of APOB including p.(R3527Q). Two families were identified with previously unreported LDLR mutations (c.1019_1020delinsTG, p.(C340L) and c.1634G>A, p.(G545E)). Both probands had tendon xanthomas or xanthelasma and/or a history of cardiovascular disease. Co-segregation with hypercholesterolemia was demonstrated in both families. In silico studies predicted these variations to be damaging. In two families, novel PCSK9 variations were identified (exon2; c.314G>A, p.(R105Q) and exon3; c.464C>T, p.(P155L)). In silico studies suggested both were likely to be damaging, and family members carrying the p.(105Q) allele had lower total cholesterol levels, suggesting this is a loss-of-function mutation. For c.464C>T p.(P155L) the small number of relatives available precluded any strong inference. This report brings to seven the number of different LDLR mutations reported in FH patients from Pakistan and, as expected in this heterogeneous population, no common LDLR mutation has been identified.",0
1,"Identification and functional analysis of GCK gene mutations in 12 Chinese families with hyperglycemia.  To investigate the clinical and genetic characteristics of Chinese patients with a phenotype consistent with maturity-onset diabetes of the young type 2 and explore the pathogenic mechanism of their hyperglycemia. We studied 12 probands and their extended families referred to our center for screening mutations in the glucokinase gene (GCK). Clinical data were collected and genetic analysis was carried out. The recombinant wild-type and mutant glucokinase were generated in Escherichia coli. The kinetic parameters and thermal stability of the enzymes were determined in vitro. In the 12 families, 11 GCK mutations (R43C, T168A, K169N, R191W, Y215X, E221K, M235T, R250H, W257X, G261R and A379E) and one variant of uncertain significance (R275H) were identified. R191W was detected in two unrelated families. Of the 11 GCK mutations, three mutations (c.507G>C, K169N; c.645C>A, Y215X; c.771G>A, W257X; NM_000162.3, NP_000153.1) are novel. Basic kinetics analysis explained the pathogenicity of the five mutants (R43C, K169N, R191W, E221K and A379E), which showed reduced enzyme activity with relative activity indexes between ~0.001 and 0.5 compared with the wild-type (1.0). In addition, the thermal stabilities of these five mutants were also decreased to varying degrees. However, for R250H and R275H, there was no significant difference in the enzyme activity and thermal stability between the mutants and the wild type. We have identified 11 GCK mutations and one variant of uncertain significance in 12 Chinese families with hyperglycemia. For five GCK mutations (R43C, K169N, R191W, E221K and A379E), the changes in enzyme kinetics and thermostability might be the pathogenic mechanisms by which mutations cause hyperglycemia.",0
1,"De novo germline and postzygotic mutations in AKT3, PIK3R2 and PIK3CA cause a spectrum of related megalencephaly syndromes.  Megalencephaly-capillary malformation (MCAP) and megalencephaly-polymicrogyria-polydactyly-hydrocephalus (MPPH) syndromes are sporadic overgrowth disorders associated with markedly enlarged brain size and other recognizable features. We performed exome sequencing in 3 families with MCAP or MPPH, and our initial observations were confirmed in exomes from 7 individuals with MCAP and 174 control individuals, as well as in 40 additional subjects with megalencephaly, using a combination of Sanger sequencing, restriction enzyme assays and targeted deep sequencing. We identified de novo germline or postzygotic mutations in three core components of the phosphatidylinositol 3-kinase (PI3K)-AKT pathway. These include 2 mutations in AKT3, 1 recurrent mutation in PIK3R2 in 11 unrelated families with MPPH and 15 mostly postzygotic mutations in PIK3CA in 23 individuals with MCAP and 1 with MPPH. Our data highlight the central role of PI3K-AKT signaling in vascular, limb and brain development and emphasize the power of massively parallel sequencing in a challenging context of phenotypic and genetic heterogeneity combined with postzygotic mosaicism.",0
1,"De novo somatic mutations in components of the PI3K-AKT3-mTOR pathway cause hemimegalencephaly.  De novo somatic mutations in focal areas are well documented in diseases such as neoplasia but are rarely reported in malformation of the developing brain. Hemimegalencephaly (HME) is characterized by overgrowth of either one of the two cerebral hemispheres. The molecular etiology of HME remains a mystery. The intractable epilepsy that is associated with HME can be relieved by the surgical treatment hemispherectomy, allowing sampling of diseased tissue. Exome sequencing and mass spectrometry analysis in paired brain-blood samples from individuals with HME (n = 20 cases) identified de novo somatic mutations in 30% of affected individuals in the PIK3CA, AKT3 and MTOR genes. A recurrent PIK3CA c.1633G>A mutation was found in four separate cases. Identified mutations were present in 8-40% of sequenced alleles in various brain regions and were associated with increased neuronal S6 protein phosphorylation in the brains of affected individuals, indicating aberrant activation of mammalian target of rapamycin (mTOR) signaling. Thus HME is probably a genetically mosaic disease caused by gain of function in phosphatidylinositol 3-kinase (PI3K)-AKT3-mTOR signaling.",0
1,"The glucocerobrosidase E326K variant predisposes to Parkinson's disease, but does not cause Gaucher's disease.  Heterozygous loss-of-function mutations in the acid beta-glucocerebrosidase (GBA1) gene, responsible for the recessive lysosomal storage disorder, Gaucher's disease (GD), are the strongest known risk factor for Parkinson's disease (PD). Our aim was to assess the contribution of GBA1 mutations in a series of early-onset PD. One hundred and eighty-five PD patients (with an onset age of ≤50) and 283 age-matched controls were screened for GBA1 mutations by Sanger sequencing. We show that the frequency of GBA1 mutations is much higher in this patient series than in typical late-onset patient cohorts. Furthermore, our results reveal that the most prevalent PD-associated GBA1 mutation is E326K, a variant that does not, when homozygous, cause GD. Our results confirm recent reports that the mutation, E326K, predisposes to PD and suggest that, in addition to reduced GBA1 activity, other molecular mechanisms may contribute to the development of the disease.",0
1,"Expression and functional characterization of mutated glucocerebrosidase alleles causing Gaucher disease in Spanish patients.  Gaucher disease (GD) is a heterogeneous disease characterized by an impaired activity of the lysosomal glucocerebrosidase. This heterogeneity is attributed in part to the existence of a large number of mutations in the corresponding gene. To establish genotype-phenotype relationships, we analyzed the residual enzyme activities of six naturally occurring mutations found in Spanish population in the glucocerebrosidase gene [c.160G > A (V15M), c.485T>C (M123T), c.914C>T (P266L), c.1124T>C (L336P), c.1207A>C (S364R) and c.1510-1512delTCT (S465del)]. The mutated genes were subcloned into the mammalian expression vector pCR 3.1 and expressed by transient transfection in COS cells. The enzymatic activity of the expressed protein were measured and compared with the wild-type human glucocerebrosidase cDNA. Also, two previously alleles, c.1226A>G (N370S) and c.1448T>C (L444P), were used for comparative purposes. The residual activity of the expressed proteins using the synthetic substrate (4-methylumbelliferyl-beta-D-glucopyranoside, 4MU-Glu) ranged from 5.5% (for the 3-bp deletion) to 42.7% (for S364R mutation) of the activity of the wild-type enzyme. The present analyses may help to better understand the molecular basis and the pathogenesis of Gaucher disease. However, results of expression of mutated enzymes are necessary but not sufficient to explain the ultimate clinical outcome of Gaucher disease.",0
1,"Pancreas duodenum homeobox-1 transcriptional activation requires interactions with p300.  The homeodomain transcription factor, pancreas duodenum homeobox (PDX)-1, is essential for pancreas development, insulin production, and glucose homeostasis. Mutations in pdx-1(ipf-1) are associated both with maturity-onset diabetes of the young and type 2 diabetes. PDX-1 interacts with multiple transcription factors and coregulators, including the coactivator p300, to activate the transcription of the insulin gene and other target genes within pancreatic beta-cells. In characterizing the protein-protein interactions of PDX-1 and p300, we identified mutations in PDX-1 that disrupt its function and are associated with increased or decreased interactions with p300. Several mutant PDX-1 proteins that are associated with heritable forms of diabetes in humans, in particular the mutant P63fsdelC, exhibited increased binding to a carboxy-terminal segment of p300 in the setting of decreased DNA-binding activities, suggesting that sequestration of p300 by mutant PDX-1 proteins may be an additional mechanism by which insulin gene expression is reduced in heterozygous carriers of pdx-1(ipf-1) mutations. The introduction of the point mutations S66A/Y68A in the highly conserved amino-terminal PDX-1 transactivation domain reduced the ability of PDX-1 to interact with p300, substantially diminished the transcriptional activation of PDX-1, and reduced the synergistic activation of glucose-responsive insulin promoter enhancer sequences by PDX-1, E12, and E47. We propose that interactions of PDX-1 with p300 are required for the transcriptional activation of PDX-1 target genes. Impairment of interactions between PDX-1 and p300 in pancreatic beta-cells may limit insulin production and lead to the development of diabetes.",0
