true_label0,Abstract,predicted_label0
1,"Brain somatic mutations in MTOR cause focal cortical dysplasia type II leading to intractable epilepsy.  Focal cortical dysplasia type II (FCDII) is a sporadic developmental malformation of the cerebral cortex characterized by dysmorphic neurons, dyslamination and medically refractory epilepsy. It has been hypothesized that FCD is caused by somatic mutations in affected regions. Here, we used deep whole-exome sequencing (read depth, 412-668×) validated by site-specific amplicon sequencing (100-347,499×) in paired brain-blood DNA from four subjects with FCDII and uncovered a de novo brain somatic mutation, mechanistic target of rapamycin (MTOR) c.7280T>C (p.Leu2427Pro) in two subjects. Deep sequencing of the MTOR gene in an additional 73 subjects with FCDII using hybrid capture and PCR amplicon sequencing identified eight different somatic missense mutations found in multiple brain tissue samples of ten subjects. The identified mutations accounted for 15.6% of all subjects with FCDII studied (12 of 77). The identified mutations induced the hyperactivation of mTOR kinase. Focal cortical expression of mutant MTOR by in utero electroporation in mice was sufficient to disrupt neuronal migration and cause spontaneous seizures and cytomegalic neurons. Inhibition of mTOR with rapamycin suppressed cytomegalic neurons and epileptic seizures. This study provides, to our knowledge, the first evidence that brain somatic activating mutations in MTOR cause FCD and identifies mTOR as a treatment target for intractable epilepsy in FCD.",0
1,"Inherited Disease Genetics Improves the Identification of Cancer-Associated Genes.  The identification of biologically significant variants in cancer genomes is critical to therapeutic discovery, but it is limited by the statistical power needed to discern driver from passenger. Independent biological data can be used to filter cancer exomes and increase statistical power. Large genetic databases for inherited diseases are uniquely suited to this task because they contain specific amino acid alterations with known pathogenicity and molecular mechanisms. However, no rigorous method to overlay this information onto the cancer exome exists. Here, we present a computational methodology that overlays any variant database onto the somatic mutations in all cancer exomes. We validate the computation experimentally and identify novel associations in a re-analysis of 7362 cancer exomes. This analysis identified activating SOS1 mutations associated with Noonan syndrome as significantly altered in melanoma and the first kinase-activating mutations in ACVR1 associated with adult tumors. Beyond a filter, significant variants found in both rare cancers and rare inherited diseases increase the unmet medical need for therapeutics that target these variants and may bootstrap drug discovery efforts in orphan indications.",0
1,"Insights into the structural biology of Gaucher disease.  Gaucher disease, the most common lysosomal storage disorder, is caused by mutations in the gene encoding the acid-β-glucosidase lysosomal hydrolase enzyme that cleaves glucocerebroside into glucose and ceramide. Reduced enzyme activity and impaired structural stability arise due to >300 known disease-causing mutations. Several of these mutations have also been associated with an increased risk of Parkinson disease (PD). Since the discovery of the acid-β-glucosidase X-ray structure, there have been major advances in our understanding of the structural properties of the protein. Analysis of specific residues has provided insight into their functional and structural importance and provided insight into the pathogenesis of Gaucher disease and the contribution to PD. Disease-causing mutations are positioned throughout the acid-β-glucosidase structure, with many located far from the active site and thus retaining some enzymatic activity however, thus far no clear relationship between mutation location and disease severity has been established. Here, we review the crystal structure of acid-β-glucosidase, while highlighting important structural aspects of the protein in detail. This review discusses the structural stability of acid-β-glucosidase, which can be altered by pH and glycosylation, and explores the relationship between known Gaucher disease and PD mutations, structural stability and disease severity.",0
1,"Degradation of LDLR protein mediated by 'gain of function' PCSK9 mutants in normal and ARH cells.  Dominant gain-of-function mutations in proprotein convertase subtilisin kexin type 9 (PCSK9) cause familial hypercholesterolaemia (FH) and result in accelerated atherosclerosis and premature coronary heart disease. It is believed that PCSK9 binds to LDL-receptor (LDLR) protein and prevents its recycling to the cell surface; gain-of-function PCSK9 mutants enhance LDLR degradation. Several new variants of PCSK9 have been identified, but their effect on PCSK9 activity has not been determined. We describe a new procedure for assessing the activity of four putative gain-of-function mutations identified in FH patients (D129N, D374H, N425S, R496W). All four mutant proteins were secreted normally from transfected HEK293T cells. Immortalized lymphocytes from normolipaemic controls were incubated with conditioned medium from transfected cells and cell-surface LDLR protein was determined by FACS. D374H was as potent as D374Y in reducing cell-surface LDLR, while the other three mutations were more potent than wild type, but less so than the D374 mutants; this correlated with total serum cholesterol in the patients. Substitution of different amino acids at 374 showed that aspartate in this position was critical; even glutamate at residue 374 increased LDLR degradation. When the assay was carried out with ARH-negative lymphocytes that are unable to internalise the LDLR, D374Y-PCSK9 was able to reduce cell-surface LDLR by 35%, compared with approximately 70% for normal lymphocytes. Thus, PCSK9-mediated LDLR degradation is not entirely dependent on ARH function. We propose a novel ARH-independent pathway for PCSK9 activity on LDLR.",0
1,"Missense mutations in the insulin promoter factor-1 gene predispose to type 2 diabetes.  The transcription factor insulin promoter factor-1 (IPF-1) plays a central role in both the development of the pancreas and the regulation of insulin gene expression in the mature pancreatic beta cell. A dominant-negative frameshift mutation in the IPF-l gene was identified in a single family and shown to cause pancreatic agenesis when homozygous and maturity-onset diabetes of the young (MODY) when heterozygous. We studied the role of IPF-1 in Caucasian diabetic and nondiabetic subjects from the United Kingdom. Three novel IPF-1 missense mutations (C18R, D76N, and R197H) were identified in patients with type 2 diabetes. Functional analyses of these mutations demonstrated decreased binding activity to the human insulin gene promoter and reduced activation of the insulin gene in response to hyperglycemia in the human beta-cell line Nes2y. These mutations are present in 1% of the population and predisposed the subject to type 2 diabetes with a relative risk of 3.0. They were not highly penetrant MODY mutations, as there were nondiabetic mutation carriers 25-53 years of age. We conclude that mutations in the IPF-1 gene may predispose to type 2 diabetes and are a rare cause of MODY and pancreatic agenesis, with the phenotype depending upon the severity of the mutation.",0
1,"Mutations in the hepatocyte nuclear factor-1alpha gene in Chinese MODY families: prevalence and functional analysis.  Maturity-onset diabetes of the young is an autosomal dominant form of diabetes characterised by an early age of onset (usually <25 years). We investigated the prevalence and trans-activating activity of hepatocyte nuclear factor (HNF) -1 alpha mutations in southern Chinese families with MODY. We screened for mutations in the HNF-1 alpha gene in 50 unrelated southern Chinese families, which fulfilled the minimum criteria for MODY. Functional properties of the mutant proteins were investigated using site-directed mutagenesis and luciferase reporter assay. Five of the 50 (10%) families were found to have mutations in the coding region, including a new nonsense mutation Q176X and four reported mutations (frameshift mutation P379fsdelCT, nonsense mutation R171X, missense mutations G20R and P112L). These mutations had decreased trans-activating activity on the human insulin gene promoter. We also detected a new intronic sequence variation IVS7nt-6 G-->A, which co-segregated with diabetes. The intronic variation creates a potential splice acceptor site and might alter the splicing of the HNF-1 alpha mRNA. Mutations in the HNF-1 alpha gene seem to be an important cause of MODY in southern Chinese. The mutations could affect normal islet function by altering the expression of target genes.",0
1,"Hypertriglyceridaemia and low plasma HDL in a patient with apolipoprotein A-V deficiency due to a novel mutation in the APOA5 gene.  APOA5 encodes a novel apolipoprotein (apo A-V) which appears to be a modulator of plasma triglyceride (TG). In apoA5 knock out mice plasma TG level increases almost fourfold, whereas in human APOA5 transgenic mice it decreases by 70%. Some SNPs in the APOA5 gene have been associated with variations in plasma TG in humans. In addition, hypertriglyceridaemic (HTG) patients have been identified who carried rare nonsense mutations in the APOA5 gene (Q139X and Q148X), predicted to result in apo A-V deficiency. In this study we report a 17-year-old male with high TG and low high density lipoprotein cholesterol (HDL-C), who at the age of two had been found to have severe HTG and eruptive xanthomas suggesting a chylomicronaemia syndrome. Plasma postheparin LPL activity, however, was normal and no mutations were found in LPL and APOC2 genes. The sequence of APOA5 gene revealed that the patient was homozygous for a point mutation (c.289 C>T) in exon 4, converting glutamine codon at position 97 into a termination codon (Q97X). Apo A-V was not detected in patient's plasma, indicating that he had complete apo A-V deficiency. The administration of a low-fat and low-oligosaccharide diet, either alone or supplemented with omega-3 fatty acids, started early in life, reduced plasma TG to a great extent but had a negligible effect on plasma HDL-C. Loss of function mutations of APOA5 gene may be the cause of severe HTG in patients without mutations in LPL and APOC2 genes.",0
1,"IPF-1/MODY4 gene missense mutation in an Italian family with type 2 and gestational diabetes.  Maturity-onset diabetes of the young (MODY) is a monogenic autosomal-dominant form of diabetes mellitus with onset before 25 years of age. Genetic variation in insulin promoter factor-1 (IPF1) (MODY4) is uncommon but may contribute to early- or late-onset diabetes as part of a polygenic background. IPF1 is a homeodomain transcription factor required for pancreas development. Our aim was to identify whether IPF1 gene mutations play a role in Italian early-onset type 2 diabetic (T2D) patients and what functional impact mutations may have in the beta cell. We screened 40 Italian early-onset type 2 diabetic probands for IPF1 mutations, performed oral glucose tolerance tests in the unaffected family members, and performed in vitro functional studies of the mutant variant. In an extended family (Italy-6) of 46 members with clinical phenotypes of gestational diabetes, MODY, and T2D, a single nucleotide change of CCT to ACT was identified at codon 33 resulting in a Pro to Thr substitution (P33T) in the IPF1 transactivation domain that also contributes to an altered metabolic status in the unaffected NM subjects. Of the 22 genotyped Italy-6 members, 9 carried the P33T allele (NM), of whom 5 have either T2D or elevated fasting glucose levels. Oral glucose tolerance tests showed higher glucose levels at 90 minutes in unaffected NM compared with unaffected NN subjects. Of the 5 female pregnant carriers of the IPF1 mutation, 4 had pregnancies complicated by reduced birth weights, miscarriages, or early postnatal deaths. In studies in vitro, the IPF1 mutant protein (P33T) showed a reduction in DNA-binding and transcriptional activation functions as compared to the wild-type IPF1 protein. Our findings suggest that the P33T IPF1 mutation may provide an increased susceptibility to the development of gestational diabetes and MODY4 in the Italy-6 pedigree.",0
1,"The p.R482W substitution in A-type lamins deregulates SREBP1 activity in Dunnigan-type familial partial lipodystrophy.  Nuclear lamins are involved in many cellular functions due to their ability to bind numerous partners including chromatin and transcription factors, and affect their properties. Dunnigan type familial partial lipodystrophy (FPLD2; OMIM#151660) is caused in most cases by the A-type lamin R482W mutation. We report here that the R482W mutation affects the regulatory activity of sterol response element binding protein 1 (SREBP1), a transcription factor that regulates hundreds of genes involved in lipid metabolism and adipocyte differentiation. Using in situ proximity ligation assays (PLA), reporter assays and biochemical and transcriptomic approaches, we show that interactions of SREBP1 with lamin A and lamin C occur at the nuclear periphery and in the nucleoplasm. These interactions involve the Ig-fold of A-type lamins and are favored upon SREBP1 binding to its DNA target sequences. We show that SREBP1, LMNA and sterol response DNA elements form ternary complexes in vitro. In addition, overexpression of A-type lamins reduces transcriptional activity of SREBP1. In contrast, both overexpression of LMNA R482W in primary human preadipocytes and endogenous expression of A-type lamins R482W in FPLD2 patient fibroblasts, reduce A-type lamins-SREBP1 in situ interactions and upregulate a large number of SREBP1 target genes. As this LMNA mutant was previously shown to inhibit adipogenic differentiation, we propose that deregulation of SREBP1 by mutated A-type lamins constitutes one underlying mechanism of the physiopathology of FPLD2. Our data suggest that SREBP1 targeting molecules could be considered in a therapeutic context.",0
1,"Evidence-based tailoring of bioinformatics approaches to optimize methods that predict the effects of nonsynonymous amino acid substitutions in glucokinase.  Computational methods that allow predicting the effects of nonsynonymous substitutions are an integral part of exome studies. Here, we validated and improved their specificity by performing a comprehensive bioinformatics analysis combined with experimental and clinical data on a model of glucokinase (GCK): 8835 putative variations, including 515 disease-associated variations from 1596 families with diagnoses of monogenic diabetes (GCK-MODY) or persistent hyperinsulinemic hypoglycemia of infancy (PHHI), and 126 variations with available or newly reported (19 variations) data on enzyme kinetics. We also proved that high frequency of disease-associated variations found in patients is closely related to their evolutionary conservation. The default set prediction methods predicted correctly the effects of only a part of the GCK-MODY-associated variations and completely failed to predict the normoglycemic or PHHI-associated variations. Therefore, we calculated evidence-based thresholds that improved significantly the specificity of predictions (≤75%). The combined prediction analysis even allowed to distinguish activating from inactivating variations and identified a group of putatively highly pathogenic variations (EVmutation score <-7.5 and SNAP2 score >70), which were surprisingly underrepresented among MODY patients and thus under negative selection during molecular evolution. We suggested and validated the first robust evidence-based thresholds, which allow improved, highly specific predictions of disease-associated GCK variations.",0
1,"Clinical and molecular characteristics of patients with Gaucher disease in Southern China.  Gaucher disease (GD) is a common lysosomal storage disorder caused by the deficiency of acid β-glucosidase, due to mutations in the GBA gene. To explore the clinical and molecular characteristics of GD patients from Southern China, GBA gene were analyzed by nest PCR and direct Sanger-sequencing. Novel missense mutations were transiently transfected in COS-7 cells by plasmid system for functional verification. Among the 22 GD patients, 19 patients were classified as type 1 and three as type 2. Over 60% of the type 1 patient had the onset before two years of age and about 42% of them died before three years of age. Six type 1 patients with L444P homozygous genotype, presented with early onset and severe hepatosplenomegaly. Four novel mutations Y22C, F109L, L149F and c.983_990delCCCACTGG were identified. The GBA activities in vitro of novel mutants Y22C, F109L and L149F were 20.2%, 6.9% and 6.5% of the wild-type, respectively. L444P mutation accounted for 47.7% of the mutant alleles. Our results revealed that type 1 GD tends to present with a severe phenotype among southern Chinese. L444P was the most prevalent mutation and L444P homozygous genotype was associated with severe type 1 GD. Three novel missense mutations identified were pathogenic.",0
1,"An improved method on stimulated T-lymphocytes to functionally characterize novel and known LDLR mutations.  The main causes of familial hypercholesterolemia (FH) are mutations in LDL receptor (LDLR) gene. Functional studies are necessary to demonstrate the LDLR function impairment caused by mutations and would be useful as a diagnostic tool if they allow discrimination between FH patients and controls. In order to identify the best method to detect LDLR activity, we compared continuous Epstein-Barr virus (EBV)-transformed B-lymphocytes and mitogen stimulated T-lymphocytes. In addition, we characterized both novel and known mutations in the LDLR gene. T-lymphocytes and EBV-transformed B-lymphocytes were obtained from peripheral blood of 24 FH patients and 24 control subjects. Functional assays were performed by incubation with fluorescent LDL followed by flow cytometry analysis. Residual LDLR activity was calculated normalizing fluorescence for the mean fluorescence of controls. With stimulated T-lymphocytes we obtained a better discrimination capacity between controls and FH patients compared with EBV-transformed B-lymphocytes as demonstrated by receiver operating characteristic (ROC) curve analysis (the areas under the curve are 1.000 and 0.984 respectively; P < 0.0001 both). The characterization of LDLR activity through T-lymphocytes is more simple and faster than the use of EBV-transformed B-lymphocytes and allows a complete discrimination between controls and FH patients. Therefore the evaluation of residual LDLR activity could be helpful not only for mutation characterization but also for diagnostic purposes.",0
1,"Monocytes of patients with familial hypercholesterolemia show alterations in cholesterol metabolism.  Elevated plasma cholesterol promotes the formation of atherosclerotic lesions in which monocyte-derived lipid-laden macrophages are frequently found. To analyze, if circulating monocytes already show increased lipid content and differences in lipoprotein metabolism, we compared monocytes from patients with Familial Hypercholesterolemia (FH) with those from healthy individuals. Cholesterol and oxidized cholesterol metabolite serum levels of FH and of healthy, gender/age matched control subjects were measured by combined gas chromatography - mass spectroscopy. Monocytes from patients with FH and from healthy subjects were isolated by antibody-assisted density centrifugation. Gene expression profiles of isolated monocytes were measured using Affymetrix HG-U 133 Plus 2.0 microarrays. We compared monocyte gene expression profiles from FH patients with healthy controls using a Welch T-test with correction for multiple testing (p < 0.05; Benjamini Hochberg correction, False Discovery Rate = 0.05). The differential expression of FH associated genes was validated at the mRNA level by qRT-PCR and/or at the protein level by Western Blot or flow cytometry. Functional validation of monocyte scavenger receptor activities were done by binding assays and dose/time dependent uptake analysis using native and oxidized LDL. Using microarray analysis we found in FH patients a significant up-regulation of 1,617 genes and a down-regulation of 701 genes compared to monocytes from healthy individuals. These include genes of proteins that are involved in the uptake, biosynthesis, disposition, and cellular efflux of cholesterol. In addition, plasma from FH patients contains elevated amounts of sterols and oxysterols. An increased uptake of oxidized as well as of native LDL by FH monocytes combined with a down-regulation of NPC1 and ABCA1 explains the lipid accumulation observed in these cells. Our data demonstrate that circulating FH monocytes show differences in cell physiology that may contribute to the early onset of atherosclerosis in this disease.",0
1,"Receptor-associated protein facilitates proper folding and maturation of the low-density lipoprotein receptor and its class 2 mutants.  Familial hypercholesterolemia is the consequence of various mutations in the low-density lipoprotein receptor (LDLR). In the current study, we show that a specialized molecular chaperone, the receptor-associated protein (RAP), promotes proper folding and subsequent exocytic trafficking of the wild-type LDLR and several of its class 2 mutants. Co-immunoprecipitation with anti-RAP antibody demonstrates that RAP interacts with the LDLR. Kinetic analyses of LDLR posttranslational folding and maturation in the absence or presence of RAP coexpression show that RAP prevents aggregation and promotes the maturation of the LDLR. Additionally, depletion of Ca(2+) in intact cells impairs LDLR folding, and coexpression of RAP partially corrects this misfolding. Finally, we show that the increased mature cell surface LDLR in the presence of RAP coexpression is functional in its ability to endocytose and degrade (125)I-LDL. Taken together, our results show that the folding, trafficking, and maturation of the LDLR and its class 2 mutants are promoted by RAP.",0
1,"AlphaIIbbeta3 integrin: new allelic variants in Glanzmann thrombasthenia, effects on ITGA2B and ITGB3 mRNA splicing, expression, and structure-function.  Glanzmann thrombasthenia (GT) is an autosomal recessive inherited bleeding disorder characterized by an impaired platelet aggregation due to defects in integrin alphaIIbbeta3 (ITGA2B, ITGB3), a fibrinogen receptor. Mutations from 24 GT patients and two carriers of various origins, Caucasian, North-African and Asian were characterized. Promoter and exon sequences of alphaIIb and beta3 genes were amplified and directly sequenced. Among 29 identified mutations, 17 new allelic variants resulting from nonsense, missense and deletion/insertion mutations were described. RNA alterations were evaluated by using Web servers. The alphaIIb p.S926L, p.V903F, and beta3 p.C38Y, p.M118R, p.G221D substitutions prevented complex expression at the surface of COS-7 cells by altering the alphaIIb or the beta3 subunit structure. As shown by free energy analyses applied on the resolved structure of alphaIIbbeta3 and structural modeling of the mutant, the p.K253M substitution of beta3 helped to define a key role of the K253 in the interaction of the alphaIIb beta-propeller and the beta3 beta-I domains. finally, the alphaIIb p.Q595H substitution allowed cell surface expression of the complex but its corresponding c.2800G>T mutation is predicted to alter normal RNA splicing. In conclusion, our study yielded the discovery of 17 new GT allelic variants, revealed the key role of K253 of alphaIIb for the alphaIIbbeta3 complex formation and provides an additional example of an apparently missense mutation causing a splicing defect.",0
1,"The molecular defects in lipoprotein lipase deficient patients.  The underlying molecular defects that lead to a deficiency of lipoprotein lipase in two patients from different kindreds presenting with the familial hyperchylomicronemia syndrome have been identified. Sequence analysis of amplified LPL cDNA of the patient from the Bethesda kindred revealed a single point mutation (G to A) at position 781 of the normal gene that resulted in the substitution of an alanine for a threonine at residue 176 and the loss of an SfaN1 site present in the normal LPL gene. Amplification of patient cDNA by the PCR followed by restriction enzyme digestion with SfaN1 established that the patient is a true homozygote for the defect. The proband from the second kindred was found to be a compound heterozygote for two separate allelic mutations, including a T to C transition at nucleotide 836 and a G to A mutation at base 983 that led to the substitution of Ile194 by Thr and Arg243 by His, respectively. Transient expression of the mutant LPL cDNAs from both kindreds in human embryonal kidney-293 cells resulted in the synthesis of enzymatically inactive proteins, establishing the functional significance of the mutations.",0
