Abstract,Classification,true_label0,predicted_label0
"Functional assessment of variants in the TSC1 and TSC2 genes identified in individuals with Tuberous Sclerosis Complex.  The effects of missense changes and small in-frame deletions and insertions on protein function are not easy to predict, and the identification of such variants in individuals at risk of a genetic disease can complicate genetic counselling. One option is to perform functional tests to assess whether the variants affect protein function. We have used this strategy to characterize variants identified in the TSC1 and TSC2 genes in individuals with, or suspected of having, Tuberous Sclerosis Complex (TSC). Here we present an overview of our functional studies on 45 TSC1 and 107 TSC2 variants. Using a standardized protocol we classified 16 TSC1 variants and 70 TSC2 variants as pathogenic. In addition we identified eight putative splice site mutations (five TSC1 and three TSC2). The remaining 24 TSC1 and 34 TSC2 variants were classified as probably neutral.",0,1,0
The LDL receptor locus in familial hypercholesterolemia: mutational analysis of a membrane protein.  ,4 0,1,0
Phenylketonuria in China: identification and characterization of three novel nucleotide substitutions in the human phenylalanine hydroxylase gene.  ,0,1,0
"Mean age-of-onset of familial alzheimer disease caused by presenilin mutations correlates with both increased Abeta42 and decreased Abeta40.  The varied ways in which mutations in presenilins (PSEN1 and PSEN2) affect amyloid b precursor protein (APP) processing in causing early-onset familial Alzheimer disease (FAD) are complex and not yet properly understood. Nonetheless, one useful diagnostic marker is an increased ratio of Ab42 to Ab40 (Ab42/Ab40) in patients' brain and biological fluids as well as in transgenic mice and cells. We studied Ab and APP processing for a set of nine clinical PSEN mutations on a novel and highly reproducible enzyme-linked immunosorbent assay (ELISA)-based in vitro method and also sought correlation with brain Ab analyzed by image densitometry and mass spectrometry. All mutations significantly increased Ab42/Ab40 in vitro by significantly decreasing Ab40 with accumulation of APP C-terminal fragments, a sign of decreased PSEN activity. A significant increase in absolute levels of Ab42 was observed for only half of the mutations tested. We also showed that age-of-onset of PSEN1-linked FAD correlated inversely with Ab42/Ab40 (r = -0.89; P = 0.001) and absolute levels of Ab42 (r = -0.83; P = 0.006), but directly with Ab40 levels (r = 0.69; P = 0.035). These changes also partly correlated with brain Ab42 and Ab40 levels. Together, our data suggested that Ab40 might be protective by perhaps sequestering the more toxic Ab42 and facilitating its clearance. Also, the in vitro method we describe here is a valid tool for assaying the pathogenic potential of clinical PSEN mutations in a molecular diagnostic setting.",0,1,0
"PTEN c.511C>T nonsense mutation in a BRRS family disrupts a potential exonic splicing enhancer and causes exon skipping.  Bannayan-Riley-Ruvalcaba syndrome (BRRS) is an autosomal dominant disorder characterized by macrocephaly, intestinal hamartomatous polyps, lipomas and pigmented macules of the glans penis. We identified a Thai family affected with BRRS. In addition to typical manifestations of BRRS, the proband has a large hepatic AVM which is rarely found in BRRS. The molecular analysis revealed affected members were heterozygous for an exon skipping-associated nonsense mutation c.511C>T in the PTEN gene. The mutation was previously assumed to be deleterious by causing a change to a termination codon, Q171X. We, herein, found that another pathogenic effect was splicing related by disrupting a potential exonic splicing enhancer (ESE) and causing an entire exon 6 skipping. The results prompted us to investigate other reported missense/nonsense mutations in the PTEN gene. We found that they do not colocalize with ESE sites, suggesting that most of their pathogenic effects are not through ESE disruption.",3 0,1,0
"Identification of CDH1 germline missense mutations associated with functional inactivation of the E-cadherin protein in young gastric cancer probands.  E-cadherin is involved in the formation of cell-junctions and the maintenance of epithelial integrity. Direct evidence of E-cadherin mutations triggering tumorigenesis has come from the finding of inactivating germline mutations of the gene (CDH1) in hereditary diffuse gastric cancer (HDGC). We screened a series of 66 young gastric cancer probands for germline CDH1 mutations, and two novel missense alterations together with an intronic variant were identified. We then analysed the functional significance of the two exonic missense variants found here as well as a third germline missense variant that we previously identified in a HGDC family. cDNAs encoding either the wild-type protein or mutant forms of E-cadherin were stably transfected into CHO (Chinese hamster ovary) E-cadherin-negative cells. Transfected cell-lines were characterized in terms of aggregation, motility and invasion. We show that a proportion of apparently sporadic early-onset diffuse gastric carcinomas are associated with germline alterations of the E-cadherin gene. We also demonstrate that a proportion of missense variants are associated with significant functional consequences, suggesting that our cell model can be used as an adjunct in deciding on the potential pathogenic role of identified E-cadherin germline alterations.",0,1,0
"Missense mutations in the N-terminal domain of human phenylalanine hydroxylase interfere with binding of regulatory phenylalanine.  Hyperphenylalaninemia due to a deficiency of phenylalanine hydroxylase (PAH) is an autosomal recessive disorder caused by >400 mutations in the PAH gene. Recent work has suggested that the majority of PAH missense mutations impair enzyme activity by causing increased protein instability and aggregation. In this study, we describe an alternative mechanism by which some PAH mutations may render PAH defective. Database searches were used to identify regions in the N-terminal domain of PAH with homology to the regulatory domain of prephenate dehydratase (PDH), the rate-limiting enzyme in the bacterial phenylalanine biosynthesis pathway. Naturally occurring N-terminal PAH mutations are distributed in a nonrandom pattern and cluster within residues 46-48 (GAL) and 65-69 (IESRP), two motifs highly conserved in PDH. To examine whether N-terminal PAH mutations affect the ability of PAH to bind phenylalanine at the regulatory domain, wild-type and five mutant (G46S, A47V, T63P/H64N, I65T, and R68S) forms of the N-terminal domain (residues 2-120) of human PAH were expressed as fusion proteins in Escherichia coli. Binding studies showed that the wild-type form of this domain specifically binds phenylalanine, whereas all mutations abolished or significantly reduced this phenylalanine-binding capacity. Our data suggest that impairment of phenylalanine-mediated activation of PAH may be an important disease-causing mechanism of some N-terminal PAH mutations, which may explain some well-documented genotype-phenotype discrepancies in PAH deficiency.",0,1,0
"Lysosome-associated protein 1 (LAMP-1) and lysosome-associated protein 2 (LAMP-2) in a larger family carrier of Fabry disease.  This study investigated the potential relationship between the expression levels of lysosome-associated membrane proteins (LAMP) 1 and 2 and responses to enzyme replacement therapy (ERT) in the members of a single family with Fabry disease (FD). LAMP levels were assessed by flow cytometry in leukocytes from 17 FD patients who received an eight-month course of ERT course and 101 healthy individuals. We found that phagocytic cells from the FD patients had higher expression levels of both LAMP-1 and LAMP-2, relative to the levels in phagocytes from the healthy controls (p=0.001). Furthermore, the LAMP-1 and LAMP-2 levels in phagocytes from the FD carriers continuously decreased with ERT administration to reach levels similar to those in healthy controls. We suggest that LAMP-1 and LAMP-2 could be used as additional markers with which to assess ERT effectiveness in FD.",0,1,0
"Functional analysis of variant lysosomal acid glycosidases of Anderson-Fabry and Pompe disease in a human embryonic kidney epithelial cell line (HEK 293 T).  The functional significance of missense mutations in genes encoding acid glycosidases of lysosomal storage disorders (LSDs) is not always clear. Here we describe a method of investigating functional properties of variant enzymes in vitro using a human embryonic kidney epithelial cell line. Site-directed mutagenesis was performed on the parental plasmids containing cDNA encoding for alpha-galactosidase A (α-Gal A) and acid maltase (α-Glu) to prepare plasmids encoding relevant point mutations. Mutant plasmids were transfected into HEK 293 T cells, and transient over-expression of variant enzymes was measured after 3 days. We have illustrated the method by examining enzymatic activities of four unknown α-Gal A and one α-Glu variants identified in our patients with Anderson-Fabry disease and Pompe diseases respectively. Comparison with control variants known to be either pathogenic or non-pathogenic together with over-expression of wild-type enzyme allowed determination of the pathogenicity of the mutation. One leader sequence novel variant of α-Gal A (p.A15T) was shown not to significantly reduce enzyme activity, whereas three other novel α-Gal A variants (p.D93Y, p.L372P and p.T410I) were shown to be pathogenic as they resulted in significant reduction of enzyme activity. A novel α-Glu variant (p.L72R) was shown to be pathogenic as this significantly reduced enzyme activity. Certain acid glycosidase variants that have been described in association with late-onset LSDs and which are known to have variable residual plasma and leukocyte enzyme activity in patients appear to show intermediate to low enzyme activity (p.N215S and p.Q279E α-Gal A respectively) in the over-expression system.",0,1,0
"Infantile-onset Pompe disease: A case series highlighting early clinical features, spectrum of disease severity and treatment response.  Pompe disease is a rare, autosomal, recessive disorder. Alterations in the gene encoding lysosomal acid alpha-glucosidase cause impaired glycogen degradation and resultant lysosomal glycogen accumulation. Classic infantile-onset Pompe disease (IPD) manifests soon after birth, severe cases have complete/near complete enzyme deficiency. IPD is associated with a broad spectrum of non-specific clinical features, and diagnostic delays are common. Without treatment, death typically occurs within the first 2 years of life. We present case experiences to help expand paediatricians' understanding of factors contributing to diagnostic delay, clinical decline and to highlight the need for timely therapy. Data were extracted from IPD cases managed at our hospital. Key aspects of clinical presentation, diagnosis, genetic variations, management and overall outcomes were collated then compared with what is already known in the literature. We report four IPD cases (three female). Two patients were cross-reactive immunological material negative. Age at symptom onset was 3-9 months, presenting clinical features were varied, and confirmatory diagnosis was significantly delayed in one patient. In concert with the literature, cardiomegaly, ventricular hypertrophy and delayed developmental milestones were seen in all four cases. Our cases demonstrate a range of disease severity, response to enzyme replacement therapy and antibody development. Significant immune responses were seen in two cases (one cross-reactive immunological material positive); despite immunomodulation therapy, both were associated with fatal outcomes. Timely diagnosis and initiation of enzyme replacement therapy is critical to patient outcomes as IPD progresses rapidly and irreversible changes in clinical status may occur during the delay.",1 0,1,0
"Functional characterisation of alpha-galactosidase a mutations as a basis for a new classification system in fabry disease.  Fabry disease (FD) is an X-linked hereditary defect of glycosphingolipid storage caused by mutations in the gene encoding the lysosomal hydrolase α-galactosidase A (GLA, α-gal A). To date, over 400 mutations causing amino acid substitutions have been described. Most of these mutations are related to the classical Fabry phenotype. Generally in lysosomal storage disorders a reliable genotype/phenotype correlation is difficult to achieve, especially in FD with its X-linked mode of inheritance. In order to predict the metabolic consequence of a given mutation, we combined in vitro enzyme activity with in vivo biomarker data. Furthermore, we used the pharmacological chaperone (PC) 1-deoxygalactonojirimycin (DGJ) as a tool to analyse the influence of individual mutations on subcellular organelle-trafficking and stability. We analysed a significant number of mutations and correlated the obtained properties to the clinical manifestation related to the mutation in order to improve our knowledge of the identity of functional relevant amino acids. Additionally, we illustrate the consequences of different mutations on plasma lyso-globotriaosylsphingosine (lyso-Gb3) accumulation in the patients' plasma, a biomarker proven to reflect the impaired substrate clearance caused by specific mutations. The established system enables us to provide information for the clinical relevance of PC therapy for a given mutant. Finally, in order to generate reliable predictions of mutant GLA defects we compared the different data sets to reveal the most coherent system to reflect the clinical situation.",3 4 0,1,0
"E-cadherin gene mutations in human gastric carcinoma cell lines.  Reduced expression of E-cadherin has been regarded as one of the main molecular events involved in dysfunction of the cell-cell adhesion system, triggering cancer invasion and metastasis. However, even with a sufficient amount of E-cadherin, cell-cell adhesion is sometimes lost in ""diffusely invasive"" human carcinomas. Ten human cancer cell lines, showing growth characterized morphologically by loose cell-cell adhesion, were analyzed for possible structural abnormalities of their expressed E-cadherin. Four of the cell lines showed strong mRNA and protein expression with no nucleotide sequence abnormalities, and mRNA was absent in four other cell lines. mRNA sequence was abnormal in the remaining two gastric carcinoma cell lines. In MKN45 (poorly differentiated adenocarcinoma), this involved a 12-bp in-frame deletion with strong expression of mRNA and protein. In KATO-III (signet ring cell carcinoma), there were four mRNA species with insertions of different sizes, among which the major transcripts (with a 7-bp insertion) caused a frameshift, and expression of both mRNA and protein was markedly reduced. In these two cell lines, DNA mutations were detected around exon-intron junctions, revealing that aberrant RNA splicing was the cause of the mRNA abnormalities. In addition, the wild-type allele of the E-cadherin locus was lost, suggesting that the E-cadherin gene had been inactivated by two hits (mutation and allele loss), similar to the mechanism for inactivation of tumor suppressor genes.",0,1,0
"Molecular genetics of the LDL receptor gene in familial hypercholesterolemia.  The low density lipoprotein (LDL) receptor is a cell surface transmembrane protein that mediates the uptake and lysosomal degradation of plasma LDL, thereby providing cholesterol to cells. Mutations disrupting the function of this receptor produce autosomal dominant familial hypercholesterolemia (FH). Affected individuals have elevated plasma levels of LDL, which causes premature coronary atherosclerosis. To date, 71 mutations in the LDL receptor gene have been characterized at a molecular level. In this report, we describe 79 additional mutations and review the insights that all 150 mutations have provided into the structure/function relationship of the receptor protein and the clinical manifestations of FH.",3 4 0,1,0
"Differential regulation of PTEN expression by androgen receptor in prostate and breast cancers.  Prostate cancer and breast cancer are the most common malignancies in the western world. Androgen receptor (AR) and PTEN both have been well documented to have important roles in prostate carcinogenesis. In contrast, AR and PTEN in breast carcinogenesis have not been well studied. Furthermore, the crosstalk and connection between those two pathways remain unclear. Increased AR expression in prostate cancers, combined with decreased PTEN expression, portends a poor clinical outcome. Paradoxically, both high AR and high PTEN levels, detected by immunohistochemistry, in primary breast carcinomas have been associated with better disease-free survival. Here, we performed in silico analysis of publicly available microarray data sets from prostate or breast carcinomas. We found an inverse correlation between AR and PTEN transcript expression in prostate cancer tissues in contrast to the positive correlation in breast cancer. These data led us to hypothesize that AR may directly affect PTEN transcriptional regulation in prostate and breast cancer cells. Here, we show for the first time that AR inhibits PTEN transcription in prostate cancer cells, whereas AR upregulates PTEN transcription in breast cancer cells, which mechanistically explains both the immunohistochemical PTEN-AR expressional data noted in clinical trials and in our in silico analysis of the transcriptomes of breast and prostate cancers. In addition, we have fine-mapped the AR-binding motif within the PTEN promoter. Here we show that, in patients with Cowden syndrome, an inherited cancer syndrome caused by germline mutations scattered throughout PTEN, point variants affecting the 3' end of the AR-binding motif result in abrogation of androgen-mediated transcriptional regulation of PTEN expression. We may speculate that the differential AR effect on PTEN may begin to explain organ-specific and perhaps sex-specific neoplasia predisposition in Cowden syndrome, as well as why only a fraction of women with germline PTEN mutations develop breast cancer, depending on the androgen steroid milieu and levels.",4 0,1,0
"In vitro expression of 34 naturally occurring mutant variants of phenylalanine hydroxylase: correlation with metabolic phenotypes and susceptibility toward protein aggregation.  Phenylalanine hydroxylase (PAH) is a homotetrameric enzyme that catalyzes the conversion of phenylalanine to tyrosine, the rate-limiting step of phenylalanine disposal in humans. Primary dysfunction of PAH caused by mutations in the PAH gene results in hyperphenylalaninemia, which may impair cognitive development unless corrected by dietary restriction of phenylalanine. The mechanism(s) by which PAH missense mutations cause enzyme impairment has been studied in detail only in a small number of cases, but existing evidence points to a major role of enhanced proteolytic degradation due to aberrant folding of mutant polypeptides. We have used two heterologous in vitro expression systems (a mammalian cell-free transcription-translation system and the pET system of Escherichia coli) to examine 34 mutations that have been associated with PAH deficiency in the Danish population. These mutations represent a broad range of amino acid substitutions, functional enzyme domains, and metabolic phenotypes. In both systems, residual in vitro activities correlated broadly with metabolic phenotypes, however, with significant discrepancies. Analysis of E. coli extracts by nondenaturing polyacrylamide gel electrophoresis and storage experiments showed that (i) in general, mutations in the N-terminal regulatory domain are associated with relatively stable proteins compared to most mutations in the central catalytic domain, and (ii) for mutations in the catalytic domain, high levels of protein aggregation do not always correspond with a severe phenotype. Our data support and extend previous evidence that PAH mutations exert their pathogenic effects by several distinct mechanisms that may operate individually or in concert.",0,1,0
"A novel germline mutation of PTEN associated with brain tumours of multiple lineages.  We have identified a novel germline mutation in the PTEN tumour suppressor gene. The mutation was identified in a patient with a glioma, and turned out to be a heterozygous germline mutation of PTEN (Arg234Gln), without loss of heterozygosity in tumour DNA. The biological consequences of this germline mutation were investigated by means of transfection studies of the mutant PTEN molecule compared to wild-type PTEN. In contrast to the wild-type molecule, the mutant PTEN protein is not capable of inducing apoptosis, induces increased cell proliferation and leads to high constitutive PKB/Akt activation, which cannot be increased anymore by stimulation with insulin. The reported patient, in addition to glioma, had suffered from benign meningioma in the past but did not show any clinical signs of Cowden disease or other hereditary diseases typically associated with PTEN germline mutations. The functional consequences of the mutation in transfection studies are consistent with high proliferative activity. Together, these findings suggest that the Arg234Gln missense mutation in PTEN has oncogenic properties and predisposes to brain tumours of multiple lineages.",3 0,1,0
"Diverse driving forces underlie the invariant occurrence of the T42A, E139D, I282V and T468M SHP2 amino acid substitutions causing Noonan and LEOPARD syndromes.  Missense PTPN11 mutations cause Noonan and LEOPARD syndromes (NS and LS), two developmental disorders with pleiomorphic phenotypes. PTPN11 encodes SHP2, an SH2 domain-containing protein tyrosine phosphatase functioning as a signal transducer. Generally, different substitutions of a particular amino acid residue are observed in these diseases, indicating that the crucial factor is the residue being replaced. For a few codons, only one substitution is observed, suggesting the possibility of specific roles for the residue introduced. We analyzed the biochemical behavior and ligand-binding properties of all possible substitutions arising from single-base changes affecting codons 42, 139, 279, 282 and 468 to investigate the mechanisms underlying the invariant occurrence of the T42A, E139D and I282V substitutions in NS and the Y279C and T468M changes in LS. Our data demonstrate that the isoleucine-to-valine change at codon 282 is the only substitution at that position perturbing the stability of SHP2's closed conformation without impairing catalysis, while the threonine-to-alanine change at codon 42, but not other substitutions of that residue, promotes increased phosphopeptide-binding affinity. The recognition specificity of the C-SH2 domain bearing the E139D substitution differed substantially from its wild-type counterpart acquiring binding properties similar to those observed for the N-SH2 domain, revealing a novel mechanism of SHP2's functional dysregulation. Finally, while functional selection does not seem to occur for the substitutions at codons 279 and 468, we point to deamination of the methylated cytosine at nucleotide 1403 as the driving factor leading to the high prevalence of the T468M change in LS.",0,1,0
"Complex functions of mutant p53 alleles from human prostate cancer.  Few studies have used multiple assays to examine the functionality of mutant p53 in prostate cancer (CaP). We employed seven functional assays to study 16 representative mutant p53 alleles, six from localized and ten from metastatic CaP. Yeast assays were employed to determine loss of function (LOF), partial function (PF), and dominant-negative status. Assays using p53-null Saos2 cells were used to determine whether mammalian cells transfected with mutant p53 could up-regulate the MDR-1 or PCNA promoters, alter IL-6 expression or confer the ability to grow in soft agar. As a further test of gain of function (GOF), p53-null PC3 cells stably transfected with these mutant p53 alleles were examined for cell cycle distributions. All 16 mutant p53 alleles demonstrated either total or partial LOF. All but one allele also had at least one gain of function; however, the pattern of GOF was different for each mutant allele. Alleles derived from both localized and metastatic CaP had similar GOF characteristics; however, only alleles from metastatic disease had significantly increased S-phase fractions. Different mutant p53 alleles from CaP had different, complex functional profiles. The lack of predictable patterns for these alleles suggest that each mutation may uniquely affect p53 function.",0,1,0
