Abstract,Classification,true_label0,predicted_label0
"Aberrant splicing of phenylalanine hydroxylase mRNA: the major cause for phenylketonuria in parts of southern Europe.  We report a mutation within the phenylalanine hydroxylase (PAH) gene that causes aberrant splicing of the mRNA and that is in tight association with chromosomal haplotypes 6, 10, and 36. Because of the high frequency of these particular haplotypes in Bulgaria, Italy, and Turkey, it appears to be one of the more frequent defects in the PAH gene causing classical phenylketonuria in this part of Europe. The mutation is a G to A transition at position 546 in intron 10 of the PAH gene, 11 bp upstream from the intron 10/exon 11 boundary. It activates a cryptic splice site and results in an in-frame insertion of 9 nucleotides between exon 10 and exon 11 of the processed mRNA. Normal amounts of liver PAH protein are present in homozygous patients, but no catalytic activity can be detected. This loss of enzyme activity is probably caused by conformational changes resulting from the insertion of three additional amino acids (Gly-Leu-Gln) between the normal sequences encoded by exon 10 and exon 11.",0,1,0
"Deamidations in recombinant human phenylalanine hydroxylase. Identification of labile asparagine residues and functional characterization of Asn --> Asp mutant forms.  Recombinant human phenylalanine hydroxylase (hPAH) expressed in Escherichia coli for 24 h at 28 degrees C has been found by two-dimensional electrophoresis to exist as a mixture of four to five molecular forms as a result of nonenzymatic deamidation of labile Asn residues. The multiple deamidations alter the functional properties of the enzyme including its affinity for l-phenylalanine and tetrahydrobiopterin, catalytic efficiency, and substrate inhibition and also result in enzyme forms more susceptible to limited tryptic proteolysis. Asn(32) in the regulatory domain deamidates very rapidly because of its nearest neighbor amino acid Gly(33) (Solstad, T., Carvalho, R. N., Andersen, O. A., Waidelich, D., and Flatmark, T. (2003) Eur. J. Biochem., in press). Matrix-assisted laser desorption/ionization time of flight-mass spectrometry of the tryptic peptides in the catalytic domain of a 24-h (28 degrees C) expressed enzyme has shown Asn(376) and Asn(133) to be labile residues. Site-directed mutagenesis of nine Asn residues revealed that the deamidations of Asn(32) and Asn(376) are the main determinants for the functional and regulatory differences observed between the 2- and 24-h-induced wild-type (wt) enzyme. The Asn(32) --> Asp, Asn(376) --> Asp, and the double mutant forms expressed for 2 h at 28 degrees C revealed qualitatively similar regulatory properties as the highly deamidated 24-h expressed wt-hPAH. Moreover, deamidation of Asn(32) in the wt-hPAH (24 h expression at 28 degrees C) and the Asn(32) --> Asp mutation both increase the initial rate of phosphorylation of Ser(16) by cAMP-dependent protein kinase (p < 0.005). By contrast, the substitution of Gly(33) with Ala or Val, both preventing the deamidation of Asn(32), resulted in enzyme forms that were phosphorylated at a similar rate as nondeamidated wt-hPAH, even on 24-h expression. The other Asn --> Asp substitutions (in the catalytic domain) revealed that Asn(207) and Asn(223) have an important stabilizing structural function. Finally, two recently reported phenylketonuria mutations at Asn residues in the catalytic domain were studied, i.e. Asn(167) --> Ile and Asn(207) --> Asp, and their phenotypes were characterized.",0,1,0
"A mutant form of PTEN linked to autism.  The tumor suppressor, phosphatase, and tensin homologue deleted on chromosome 10 (PTEN), is a phosphoinositide (PI) phosphatase specific for the 3-position of the inositol ring. PTEN has been implicated in autism for a subset of patients with macrocephaly. Various studies identified patients in this subclass with one normal and one mutated PTEN gene. We characterize the binding, structural properties, activity, and subcellular localization of one of these autism-related mutants, H93R PTEN. Even though this mutation is located at the phosphatase active site, we find that it affects the functions of neighboring domains. H93R PTEN binding to phosphatidylserine-bearing model membranes is 5.6-fold enhanced in comparison to wild-type PTEN. In contrast, we find that binding to phosphatidylinositol-4,5-bisphosphate (PI(4,5)P(2)) model membranes is 2.5-fold decreased for the mutant PTEN in comparison to wild-type PTEN. The structural change previously found for wild-type PTEN upon interaction with PI(4,5)P(2), is absent for H93R PTEN. Consistent with the increased binding to phosphatidylserine, we find enhanced plasma membrane association of PTEN-GFP in U87MG cells. However, this enhanced plasma membrane association does not translate into increased PI(3,4,5)P(3) turnover, since in vivo studies show a reduced activity of the H93R PTEN-GFP mutant. Because the interaction of PI(4,5)P(2) with PTEN's N-terminal domain is diminished by this mutation, we hypothesize that the interaction of PTEN's N-terminal domain with the phosphatase domain is impacted by the H93R mutation, preventing PI(4,5)P(2) from inducing the conformational change that activates phosphatase activity.",0,1,0
"Systematic Functional Interrogation of Rare Cancer Variants Identifies Oncogenic Alleles.  Cancer genome characterization efforts now provide an initial view of the somatic alterations in primary tumors. However, most point mutations occur at low frequency, and the function of these alleles remains undefined. We have developed a scalable systematic approach to interrogate the function of cancer-associated gene variants. We subjected 474 mutant alleles curated from 5,338 tumors to pooled in vivo tumor formation assays and gene expression profiling. We identified 12 transforming alleles, including two in genes (PIK3CB, POT1) that have not been shown to be tumorigenic. One rare KRAS allele, D33E, displayed tumorigenicity and constitutive activation of known RAS effector pathways. By comparing gene expression changes induced upon expression of wild-type and mutant alleles, we inferred the activity of specific alleles. Because alleles found to be mutated only once in 5,338 tumors rendered cells tumorigenic, these observations underscore the value of integrating genomic information with functional studies. Experimentally inferring the functional status of cancer-associated mutations facilitates the interpretation of genomic information in cancer. Pooled in vivo screen and gene expression profiling identified functional variants and demonstrated that expression of rare variants induced tumorigenesis. Variant phenotyping through functional studies will facilitate defining key somatic events in cancer. Cancer Discov; 6(7); 714-26. ©2016 AACR.See related commentary by Cho and Collisson, p. 694This article is highlighted in the In This Issue feature, p. 681.",0,1,0
"PTEN coordinates G(1) arrest by down-regulating cyclin D1 via its protein phosphatase activity and up-regulating p27 via its lipid phosphatase activity in a breast cancer model.  The tumour suppressor gene PTEN/MMAC1/TEP1 encodes a dual-specificity phosphatase that recognizes phosphatidylinositol-3,4,5-triphosphate and protein substrates. We have shown previously that over-expression of PTEN in a tetracycline-controlled inducible system blocks cell cycle progression and induces apoptosis in MCF-7 breast cancer cells. Here, we demonstrate that over-expression of wild-type PTEN leads to the suppression of cell growth through the blockade of cell cycle progression, an increase in the abundance of p27, a decrease in the protein levels of cyclin D1 and the inhibition of Akt phosphorylation. In contrast, expression of the phosphatase-dead mutant, C124S, promotes cell growth and has the opposite effect on the abundance of p27, cyclin D1 levels and the phosphorylation of Akt. The G129E mutant, which does not have lipid phosphatase activity but retains protein phosphatase activity, behaves like C124S except that the former causes decreases in cyclin D1 levels similar to wild-type PTEN. Therefore, PTEN exerts its growth suppression through lipid phosphatase-dependent and independent activities and most likely, via the coordinate effect of both protein phosphatase and lipid phosphatase activities. Addition of either estrogen or insulin abrogates PTEN-mediated up-regulation of p27 and partially blocks PTEN-mediated growth suppression, whereas the combination of estrogen and insulin eliminates the alterations of p27 and cyclin D1 and completely blocks PTEN-mediated growth suppression. Our findings demonstrate that PTEN blocks cell cycle progression differentially through down-regulating the positive cell cycle regulator, cyclin D1, by its protein phosphatase activity, and up-regulating the negative cell cycle regulator, p27, by its lipid phosphatase activity.",0,1,0
"The pharmacological chaperone AT2220 increases the specific activity and lysosomal delivery of mutant acid alpha-glucosidase, and promotes glycogen reduction in a transgenic mouse model of Pompe disease.  Pompe disease is an inherited lysosomal storage disorder that results from a deficiency in acid α-glucosidase (GAA) activity due to mutations in the GAA gene. Pompe disease is characterized by accumulation of lysosomal glycogen primarily in heart and skeletal muscles, which leads to progressive muscle weakness. We have shown previously that the small molecule pharmacological chaperone AT2220 (1-deoxynojirimycin hydrochloride, duvoglustat hydrochloride) binds and stabilizes wild-type as well as multiple mutant forms of GAA, and can lead to higher cellular levels of GAA. In this study, we examined the effect of AT2220 on mutant GAA, in vitro and in vivo, with a primary focus on the endoplasmic reticulum (ER)-retained P545L mutant form of human GAA (P545L GAA). AT2220 increased the specific activity of P545L GAA toward both natural (glycogen) and artificial substrates in vitro. Incubation with AT2220 also increased the ER export, lysosomal delivery, proteolytic processing, and stability of P545L GAA. In a new transgenic mouse model of Pompe disease that expresses human P545L on a Gaa knockout background (Tg/KO) and is characterized by reduced GAA activity and elevated glycogen levels in disease-relevant tissues, daily oral administration of AT2220 for 4 weeks resulted in significant and dose-dependent increases in mature lysosomal GAA isoforms and GAA activity in heart and skeletal muscles. Importantly, oral administration of AT2220 also resulted in significant glycogen reduction in disease-relevant tissues. Compared to daily administration, less-frequent AT2220 administration, including repeated cycles of 4 or 5 days with AT2220 followed by 3 or 2 days without drug, respectively, resulted in even greater glycogen reductions. Collectively, these data indicate that AT2220 increases the specific activity, trafficking, and lysosomal stability of P545L GAA, leads to increased levels of mature GAA in lysosomes, and promotes glycogen reduction in situ. As such, AT2220 may warrant further evaluation as a treatment for Pompe disease.",0,1,0
"Diverse PAH transcripts in lymphocytes of PKU patients with putative nonsense (G272X, Y356X) and missense (P281L, R408Q) mutations.  The majority of mutations in the human phenylalanine hydroxylase (PAH) gene that lead to the recessive disease phenylketonuria (PKU) are believed to affect the activity or stability of the PAH enzyme. In this study we have performed in vivo analyses of lymphocyte PAH mRNA from PKU patients homozygous for the PKU missense mutations P281L and R408Q as well as the nonsense mutations G272X and Y356X. The mutations G272X, P281L and R408Q, which are located outside the consensus splice site sequence, result in transcripts with one or more exons skipped in addition to full-length transcripts. The mutation Y356X results in transcripts with one or more exons skipped, but no full-length transcripts. Our findings question the value of functional and structural predictions of mutations at the protein level without analyses of the corresponding transcript.",3 0,1,0
"Molecular epidemiology and genotype-phenotype correlation in phenylketonuria patients from South Spain.  The aim of this study was to identify the most common genotypes in the phenylketonuria (PKU) population of Andalusia, assessing the correlation with the phenotype and the usefulness in predicting the response to treatment with tetrahydrobiopterin. We conducted a retrospective observational study between January 1980 and January 2010 in 147 Andalusian PKU patients assessing phenotype, genotype and response to a 24-h BH4 loading test. Our cohort of patients exhibited 65 different mutations, 69.2% corresponding to the missense type, in a total of 123 different genotypes. IVS10nt-11g>a was the most common mutation (10.9%). Four novel missense mutations were identified: p.L258P; p.E66K, p.R155C and p.P122S. Although generally there is a good genotype-phenotype correlation, for eight of the repeated genotypes a slightly different phenotype was observed. In 96 PKU subjects BH4 challenge was carried out. Patients with previously reported unresponsive mutations on both alleles showed a negative response, while 95.5% (28/29) of the responsive patients carry at least one missense mutation previously associated to the BH4. Our data reveal a great genetic heterogeneity in the Andalusian population. Genotype is quite a good predictor of the phenotype and of the responsiveness to tetrahydrobiopterin, which is relevant for patient management and follow-up.",3 1 0,1,0
"COOH-terminal truncated cardiac myosin-binding protein C mutants resulting from familial hypertrophic cardiomyopathy mutations exhibit altered expression and/or incorporation in fetal rat cardiomyocytes.  Mutations in human cardiac myosin-binding protein C (cMyBP-C) gene are associated with familial hypertrophic cardiomyopathy (FHC), and most of them are predicted to produce COOH-truncated proteins. To understand the molecular mechanism(s) by which such mutations cause FHC, we analyzed (i) the accumulation of human cMyBP-C mutants in fetal rat cardiomyocytes, and (ii) the protein sequence of the human wild-type (wt) cMyBP-C by hydrophobic cluster analysis with the aim of identifying new putative myosin-binding site(s). Accumulation and sarcomeric localization of the wt protein and of four FHC-mutant cMyBP-Cs (E542Q and three COOH-truncated proteins) were studied in cardiomyocytes by immunostaining and confocal microscopy after transfection with myc-tagged constructs. We found that: (i) 10 % of the cells expressing COOH-truncated mutants exhibit an incorporation into the A-band of the sarcomere without any alteration of the myofibrillar architecture versus 76 % of those expressing the wt or E542Q mutant cMyBP-Cs (p<0.001); (ii) 90 % of the cells expressing the truncated mutants show a diffuse localization of these proteins in the cardiomyocytes, out of which 45 % exhibit a significant alteration of the sarcomeric structure (p<0.0001 versus wt); and (iii) the two shortest mutant cMyBP-Cs accumulate at very low levels in fetal rat cardiomyocytes as compared to the wt (p<0.008). Protein sequence analysis indicated that a 45-residue sequence in the NH2-terminal C0 domain of cMyBP-C exhibits a consistent homology (sequence similarity score of 42 %) with a segment of the NH2-terminal domain of myomesin, another myosin-binding protein. This result suggests that the C0 domain of human cMyBP-C contains a novel putative myosin-binding site that could account for the A-band incorporation of the truncated mutants. In addition, the faint accumulation and the diffuse localization of truncated mutants could probably be explained by a low affinity of the C0 domain for myosin. We conclude that COOH-truncated cMyBP-Cs may act as poison polypeptides that disrupt the myofibrillar architecture and result in the defects observed in FHC.",0,1,0
"Point mutations in TOR confer Rheb-independent growth in fission yeast and nutrient-independent mammalian TOR signaling in mammalian cells.  Rheb is a unique member of the Ras superfamily GTP-binding proteins. We as well as others previously have shown that Rheb is a critical component of the TSC/TOR signaling pathway. In fission yeast, Rheb is encoded by the rhb1 gene. Rhb1p is essential for growth and directly interacts with Tor2p. In this article, we report identification of 22 single amino acid changes in the Tor2 protein that enable growth in the absence of Rhb1p. These mutants also exhibit decreased mating efficiency. Interestingly, the mutations are located in the C-terminal half of the Tor2 protein, clustering mainly within the FAT and kinase domains. We noted some differences in the effect of a mutation in the FAT domain (L1310P) and in the kinase domain (E2221K) on growth and mating. Although the Tor2p mutations bypass Rhb1p's requirement for growth, they are incapable of suppressing Rhb1p's requirement for resistance to stress and toxic amino acids, pointing to multiple functions of Rhb1p. In mammalian systems, we find that mammalian target of rapamycin (mTOR) carrying analogous mutations (L1460P or E2419K), although sensitive to rapamycin, exhibits constitutive activation even when the cells are starved for nutrients. These mutations do not show significant difference in their ability to form complexes with Raptor, Rictor, or mLST8. Furthermore, we present evidence that mutant mTOR can complex with wild-type mTOR and that this heterodimer is active in nutrient-starved cells.",0,1,0
"Molecular genetics of phenylketonuria in Mediterranean countries: a mutation associated with partial phenylalanine hydroxylase deficiency.  We report the characterization of a mutation in the phenylalanine hydroxylase (PAH) gene associated with partial residual activity of the enzyme. This point mutation (280glu----lys) was found by sequencing a mutant cDNA clone derived from a needle biopsy of the liver in a child with variant form of phenylketonuria. There is a strict concordance between homozygosity for the mutation and this particular phenotype. The (280glu----lys) mutation is linked to an original and rare RFLP haplotype at the PAH locus found in south Europe and North Africa. So far, this genotype-haplotype association is both inclusive and exclusive. Thirty-three PAH-deficient patients were screened for the mutation by using polymerase chain-reaction amplification of their genomic DNA extracted from Guthrie cards. Since a large number of patients can be screened for a particular mutation by using Guthrie cards, the possibility arises of using these samples collected by national newborn screening centers for prospective and retrospective detection of other mutations in the human genome.",3 0,1,0
"Structure/function analysis of the domains required for the multimerisation of phenylalanine hydroxylase.  Phenylalanine hydroxylase (PAH) exists as an equilibrium of dimers and tetramers. However, there is little information concerning the inter- or intra-molecular interactions required for enzyme quaternary structure. It is predicted that the formation of a PAH tetramer will require at least two points of contact per enzyme subunit. Sequence analysis has suggested the existence of a C-terminal domain with characteristics of a leucine zipper or a variant of this called a coiled-coil. By deletion of 24 amino acids from the C-terminus or conversion of leucine 448 to an alanine residue, we have shown that this putative leucine zipper/coiled-coil domain is involved in the assembly of an active enzyme tetramer from dimers. The removal of this C-terminal domain of PAH reduces enzyme activity but does not abolish it. Furthermore, we report that an alanine 447 to aspartate mutation associated with phenylketonuria may affect subunit assembly which suggests the formation of enzyme tetramers is physiologically relevant. Our analysis of subunit interactions in vivo, show that in the absence of the C-terminal coiled-coil domain, dimers can form and this is only possible when the N-terminal domain is present. This provides the first evidence that N-terminal domain is required for multimerisation. We propose that the N-terminal regulatory domain in conjunction with the C-terminal coiled-coil domain, mediates the formation of fully active enzyme tetramers.",0,1,0
"The importance of an integrated analysis of clinical, molecular, and functional data for the genetic diagnosis of familial hypercholesterolemia.  Familial hypercholesterolemia (FH) is one of the most common monogenic disorders, and the high concentrations of low-density lipoprotein (LDL) cholesterol presented since birth confers on these patients an increased cardiovascular risk. More than 1,600 alterations have been described in the LDL receptor gene (LDLR), but a large number need to be validated as mutations causing disease to establish a diagnosis of FH. This study aims to characterize, both at the phenotypic and genotypic levels, families with a clinical diagnosis of FH and present evidence for the importance of the integration of clinical, molecular, and functional data for the correct diagnosis of patients with FH. A detailed analysis of the phenotype and genotype presented by 55 families with 13 different alterations in the LDLR was conducted. For eight of these, an extensive functional characterization was performed by flow cytometry, confocal microscopy, and reverse transcriptase polymerase chain reaction. Carriers of neutral alterations presented a significantly lower incidence of premature cardiovascular disease, lower levels of atherogenic lipoproteins and a large number of these individuals had LDL-cholesterol values below the 75(th) percentile. presented a significantly lower incidence of premature cardiovascular disease, lower levels of atherogenic lipoproteins and a large number of these individuals had LDL-cholesterol values below the 75th percentile However, the functional study was essential to determine the pathogenicity of variants. The data collected illustrate the importance of this integrated analysis for the correct assessment of patients with FH who can otherwise be misdiagnosed.",2 4 0,1,0
"Nuclear Excluded Autism-Associated Phosphatase and Tensin Homolog Mutations Dysregulate Neuronal Growth.  Phosphatase and tensin homolog (PTEN) negatively regulates downstream protein kinase B signaling, resulting in decreased cellular growth and proliferation. PTEN is mutated in a subset of children with autism spectrum disorder (ASD); however, the mechanism by which specific point mutations alter PTEN function is largely unknown. Here, we assessed how ASD-associated single-nucleotide variations in PTEN (ASD-PTEN) affect function. We used viral-mediated molecular substitution of human PTEN into Pten knockout mouse neurons and assessed neuronal morphology to determine the functional impact of ASD-PTEN. We employed molecular cloning to examine how PTEN's stability, subcellular localization, and catalytic activity affect neuronal growth. We identified a set of ASD-PTEN mutations displaying altered lipid phosphatase function and subcellular localization. We demonstrated that wild-type PTEN can rescue the neuronal hypertrophy, while PTEN H93R, F241S, D252G, W274L, N276S, and D326N failed to rescue this hypertrophy. A subset of these mutations lacked nuclear localization, prompting us to examine the role of nuclear PTEN in regulating neuronal growth. We found that nuclear PTEN alone is sufficient to regulate soma size. Furthermore, forced localization of the D252G and W274L mutations into the nucleus partially restores regulation of soma size. ASD-PTEN mutations display decreased stability, catalytic activity, and/or altered subcellular localization. Mutations lacking nuclear localization uncover a novel mechanism whereby lipid phosphatase activity in the nucleus can regulate mammalian target of rapamycin signaling and neuronal growth.",0,1,0
"Letter to the Editors: Concerning ""Divergent clinical outcomes of alphaglucosidase enzyme replacement therapy in two siblings with infantile-onset Pompe disease treated in the symptomatic or pre-symptomatic state"" by Takashi M et al.  ",1 0,1,0
"Structure of human lysosomal acid α-glucosidase-a guide for the treatment of Pompe disease.  Pompe disease, a rare lysosomal storage disease caused by deficiency of the lysosomal acid α-glucosidase (GAA), is characterized by glycogen accumulation, triggering severe secondary cellular damage and resulting in progressive motor handicap and premature death. Numerous disease-causing mutations in the gaa gene have been reported, but the structural effects of the pathological variants were unknown. Here we present the high-resolution crystal structures of recombinant human GAA (rhGAA), the standard care of Pompe disease. These structures portray the unbound form of rhGAA and complexes thereof with active site-directed inhibitors, providing insight into substrate recognition and the molecular framework for the rationalization of the deleterious effects of disease-causing mutations. Furthermore, we report the structure of rhGAA in complex with the allosteric pharmacological chaperone N-acetylcysteine, which reveals the stabilizing function of this chaperone at the structural level.",0,1,0
