Abstract,Classification,true_label0,predicted_label0
"Long-term weight-loss in gastric bypass patients carrying melanocortin 4 receptor variants.  The melanocortin 4 receptor (MC4R) critically regulates feeding and satiety. Rare variants in MC4R are predominantly found in obese individuals. Though some rare variants in MC4R discovered in patients have defects in localization, ligand binding and signaling to cAMP, many have no recognized defects. In our cohort of 1433 obese subjects that underwent Roux-en-Y Gastric Bypass (RYGB) surgery, we found fifteen variants of MC4R. We matched rare variant carriers to patients with the MC4R reference alleles for gender, age, starting BMI and T2D to determine the variant effect on weight-loss post-RYGB. In vitro, we determined expression of mutant receptors by ELISA and western blot, and cAMP production by microscopy. While carrying a rare MC4R allele is associated with obesity, carriers of rare variants exhibited comparable weight-loss after RYGB to non-carriers. However, subjects carrying three of these variants, V95I, I137T or L250Q, lost less weight after surgery. In vitro, the R305Q mutation caused a defect in cell surface expression while only the I137T and C326R mutations showed impaired cAMP signaling. Despite these apparent differences, there was no correlation between in vitro signaling and pre- or post-surgery clinical phenotype. These data suggest that subtle differences in receptor signaling conferred by rare MC4R variants combined with additional factors predispose carriers to obesity. In the absence of complete MC4R deficiency, these differences can be overcome by the powerful weight-reducing effects of bariatric surgery. In a complex disorder such as obesity, genetic variants that cause subtle defects that have cumulative effects can be overcome after appropriate clinical intervention.",4 0,1,0
"Comparison of the protein-protein interfaces in the p53-DNA crystal structures: towards elucidation of the biological interface.  p53, the tumor suppressor protein, functions as a dimer of dimers. However, how the tetramer binds to the DNA is still an open question. In the crystal structure, three copies of the p53 monomers (containing chains A, B, and C) were crystallized with the DNA-consensus element. Although the structure provides crucial data on the p53-DNA contacts, the active oligomeric state is unclear because the two dimeric (A-B and B-C) interfaces present in the crystal cannot both exist in the tetramer. Here, we address the question of which of these two dimeric interfaces may be more biologically relevant. We analyze the sequence and structural properties of the p53-p53 dimeric interfaces and carry out extensive molecular dynamics simulations of the crystal structures of the human and mouse p53 dimers. We find that the A-B interface residues are more conserved than those of the B-C. Molecular dynamics simulations show that the A-B interface can provide a stable DNA-binding motif in the dimeric state, unlike B-C. Our results indicate that the interface between chains A-B in the p53-DNA complex constitutes a better candidate for a stable biological interface, whereas the B-C interface is more likely to be due to crystal packing. Thus, they have significant implications toward our understanding of DNA binding by p53 as well as p53-mediated interactions with other proteins.",0,1,0
Molecular characterization of phenylketonuric mutations in Japanese by analysis of phenylalanine hydroxylase mRNA from lymphoblasts.  ,0,1,0
"Role of protein misfolding in DFNA9 hearing loss.  Mutations in the COCH (coagulation factor C homology) gene have been attributed to DFNA9 (deafness, autosomal-dominant 9), an autosomal-dominant non-syndromic hearing loss disorder. However, the mechanisms responsible for DFNA9 hearing loss remain unknown. Here, we demonstrate that mutant cochlin, the protein product of the COCH gene, forms a stable dimer that is sensitive to reducing agent. In contrast, wild-type (WT) cochlin may form only dimers transiently. Interestingly, the presence of mutant cochlin can stabilize WT cochlin in dimer conformation, providing a possible mechanism for the dominant nature of DFNA9 mutations. Furthermore, the expression of mutant cochlin eventually induces WT cochlin to form stable oligomers that are resistant to reducing agent. Finally, we show that mutant cochlin is cytotoxic in vitro and in vivo. Our study suggests a possible molecular mechanism underlying DFNA9 hearing loss and provides an in vitro model that may be used to explore protein-misfolding diseases in general.",0,1,0
"Human gene-centered transcription factor networks for enhancers and disease variants.  Gene regulatory networks (GRNs) comprising interactions between transcription factors (TFs) and regulatory loci control development and physiology. Numerous disease-associated mutations have been identified, the vast majority residing in non-coding regions of the genome. As current GRN mapping methods test one TF at a time and require the use of cells harboring the mutation(s) of interest, they are not suitable to identify TFs that bind to wild-type and mutant loci. Here, we use gene-centered yeast one-hybrid (eY1H) assays to interrogate binding of 1,086 human TFs to 246 enhancers, as well as to 109 non-coding disease mutations. We detect both loss and gain of TF interactions with mutant loci that are concordant with target gene expression changes. This work establishes eY1H assays as a powerful addition to the toolkit of mapping human GRNs and for the high-throughput characterization of genomic variants that are rapidly being identified by genome-wide association studies.",0,1,0
"Validation of LDLr Activity as a Tool to Improve Genetic Diagnosis of Familial Hypercholesterolemia: A Retrospective on Functional Characterization of LDLr Variants.  Familial hypercholesterolemia (FH) is an autosomal dominant disorder characterized by high blood-cholesterol levels mostly caused by mutations in the low-density lipoprotein receptor (LDLr). With a prevalence as high as 1/200 in some populations, genetic screening for pathogenic LDLr mutations is a cost-effective approach in families classified as 'definite' or 'probable' FH and can help to early diagnosis. However, with over 2000 LDLr variants identified, distinguishing pathogenic mutations from benign mutations is a long-standing challenge in the field. In 1998, the World Health Organization (WHO) highlighted the importance of improving the diagnosis and prognosis of FH patients thus, identifying LDLr pathogenic variants is a longstanding challenge to provide an accurate genetic diagnosis and personalized treatments. In recent years, accessible methodologies have been developed to assess LDLr activity in vitro, providing experimental reproducibility between laboratories all over the world that ensures rigorous analysis of all functional studies. In this review we present a broad spectrum of functionally characterized missense LDLr variants identified in patients with FH, which is mandatory for a definite diagnosis of FH.",0,1,0
"Pompe disease: early diagnosis and early treatment make a difference.  Pompe disease (glycogen storage disease type II or acid maltase deficiency) is a lysosomal disorder in which acid α-glucosidase (GAA) deficiencies lead to intralysosomal accumulation of glycogen in all tissues; most notably in skeletal muscles. Both the patient's age at the onset of Pompe disease symptoms and the rate of deterioration caused by the disease can vary considerably. In classical infant-onset Pompe disease (IOPD), symptoms start very early in life, and death occurs soon afterward if the disease remains untreated. In later-onset Pompe disease, symptoms are slower to appear, and patients often progress to wheelchair confinement and eventual respiratory failure. A diagnosis can be made by screening for GAA in dried blood samples, followed either by GAA assessment in lymphocytes or in fibroblasts or by the genetic analysis of mutations. Treatment by enzyme replacement therapy (ERT) with alglucosidase alfa was approved for human use in 2006. In classical IOPD, treatment significantly lengthens survival and improves motor development and cardiac function. The sooner ERT begins, the better are the results. Newborn screening aims to take advantage of different technologies for diagnosing and treating newborns early on and it yields better outcomes. However, newborns diagnosed early and other long-term survivors may encounter fresh problems, making up a new phenotype of IOPD patients. Further modifications of the treatment, such as a decrease in immune responses to ERT, a higher dosage, a better uptake formulation, and gene therapy delivered locally or systemically are being explored.",0,1,0
"Identification of seven novel germline mutations in the human E-cadherin (CDH1) gene.  Hereditary diffuse gastric cancer (HDGC) is a cancer predisposition syndrome caused by germline mutation of the gene encoding the tumour-suppressor E-cadherin (CDH1). We describe the search for CDH1 mutations in 36 new diffuse gastric cancer families. All 16 CDH1 exons, neighbouring intronic sequence and an essential promoter region were screened by DNA sequencing. We detected nine different mutations, seven of which were novel. Of the seven novel mutations, five were identified in families who met the IGCLC clinical criteria for HDGC. Two mutations resulted in a premature stop codon and truncation of the protein. Three mutations affected splice sites; two of the splice-site mutations were shown by RT-PCR to disturb normal CDH1 splicing, while the third splice-site mutation was present in two unrelated HDGC families. The remaining two mutations resulted in amino acid substitutions and impaired the ability of E-cadherin protein to form cellular aggregates and suppress invasion in vitro. Together with the occurrence of extra-gastric tumours such as lobular breast and colorectal cancer, these findings further extend the types of CDH1 mutations and the spectrum of tumours associated with HDGC.",2 4 0 3,1,0
"Germline intronic and exonic mutations in the Wilms' tumour gene (WT1) affecting urogenital development.  Denys-Drash syndrome is a rare human developmental disorder affecting the urogenital system and leading to renal failure, intersex disorders and Wilms' tumour. In this report, four individuals with this syndrome are described carrying germline point mutations in the Wilms' tumour suppressor gene, WT1. Three of these mutations were in the zinc finger domains of WT1. The fourth occurred within intron 9, preventing splicing at one of the alternatively chosen splice donor sites of exon 9 when assayed in vitro. These results provide genetic evidence for distinct functional roles of the WT1 isoforms in urogenital development.",0,1,0
"A global suppressor motif for p53 cancer mutants.  The transcription factor and tumor suppressor protein p53 is frequently inactivated in human cancers. In many cases, p53 gene mutations result in high levels of inactive, full-length p53 protein with one amino acid change in the core domain that recognizes p53 DNA-binding sites. The ability to endow function to mutated p53 proteins would dramatically improve cancer therapy, because it would reactivate a central apoptotic pathway. By using genetic strategies and p53 assays in yeast and mammalian cells, we identified a global suppressor motif involving codons 235, 239, and 240. These intragenic suppressor mutations, either alone or in combination, restored function to 16 of 30 of the most common p53 cancer mutants tested. The 235-239-240 suppressor motif establishes that manipulation of a small region of the core domain is sufficient to activate a large number of p53 cancer mutants. Understanding the structural basis of the rescue mechanism will allow the pursuit of small compounds able to achieve a similar stabilization of p53 cancer mutants.",0,1,0
"Analysis of trafficking, stability and function of human connexin 26 gap junction channels with deafness-causing mutations in the fourth transmembrane helix.  Human Connexin26 gene mutations cause hearing loss. These hereditary mutations are the leading cause of childhood deafness worldwide. Mutations in gap junction proteins (connexins) can impair intercellular communication by eliminating protein synthesis, mis-trafficking, or inducing channels that fail to dock or have aberrant function. We previously identified a new class of mutants that form non-functional gap junction channels and hemichannels (connexons) by disrupting packing and inter-helix interactions. Here we analyzed fourteen point mutations in the fourth transmembrane helix of connexin26 (Cx26) that cause non-syndromic hearing loss. Eight mutations caused mis-trafficking (K188R, F191L, V198M, S199F, G200R, I203K, L205P, T208P). Of the remaining six that formed gap junctions in mammalian cells, M195T and A197S formed stable hemichannels after isolation with a baculovirus/Sf9 protein purification system, while C202F, I203T, L205V and N206S formed hemichannels with varying degrees of instability. The function of all six gap junction-forming mutants was further assessed through measurement of dye coupling in mammalian cells and junctional conductance in paired Xenopus oocytes. Dye coupling between cell pairs was reduced by varying degrees for all six mutants. In homotypic oocyte pairings, only A197S induced measurable conductance. In heterotypic pairings with wild-type Cx26, five of the six mutants formed functional gap junction channels, albeit with reduced efficiency. None of the mutants displayed significant alterations in sensitivity to transjunctional voltage or induced conductive hemichannels in single oocytes. Intra-hemichannel interactions between mutant and wild-type proteins were assessed in rescue experiments using baculovirus expression in Sf9 insect cells. Of the four unstable mutations (C202F, I203T, L205V, N206S) only C202F and N206S formed stable hemichannels when co-expressed with wild-type Cx26. Stable M195T hemichannels displayed an increased tendency to aggregate. Thus, mutations in TM4 cause a range of phenotypes of dysfunctional gap junction channels that are discussed within the context of the X-ray crystallographic structure.",0,1,0
"Pilot study of newborn screening for six lysosomal storage diseases using Tandem Mass Spectrometry.  There is current expansion of newborn screening (NBS) programs to include lysosomal storage disorders because of the availability of treatments that produce an optimal clinical outcome when started early in life. To evaluate the performance of a multiplex-tandem mass spectrometry (MS/MS) enzymatic activity assay of 6 lysosomal enzymes in a NBS laboratory for the identification of newborns at risk for developing Pompe, Mucopolysaccharidosis-I (MPS-I), Fabry, Gaucher, Niemann Pick-A/B, and Krabbe diseases. Enzyme activities (acid α-glucosidase (GAA), galactocerebrosidase (GALC), glucocerebrosidase (GBA), α-galactosidase A (GLA), α-iduronidase (IDUA) and sphingomyeline phosphodiesterase-1 (SMPD-1)) were measured on ~43,000 de-identified dried blood spot (DBS) punches, and screen positive samples were submitted for DNA sequencing to obtain genotype confirmation of disease risk. The 6-plex assay was efficiently performed in the Washington state NBS laboratory by a single laboratory technician at the bench using a single MS/MS instrument. The number of screen positive samples per 100,000 newborns were as follows: GAA (4.5), IDUA (13.6), GLA (18.2), SMPD1 (11.4), GBA (6.8), and GALC (25.0). A 6-plex MS/MS assay for 6 lysosomal enzymes can be successfully performed in a NBS laboratory. The analytical ranges (enzyme-dependent assay response for the quality control HIGH sample divided by that for all enzyme-independent processes) for the 6-enzymes with the MS/MS is 5- to 15-fold higher than comparable fluorimetric assays using 4-methylumbelliferyl substrates. The rate of screen positive detection is consistently lower for the MS/MS assay compared to the fluorimetric assay using a digital microfluidics platform.",0,1,0
"Dominant-negative features of mutant TP53 in germline carriers have limited impact on cancer outcomes.  Germline TP53 mutations result in cancer proneness syndromes known as Li-Fraumeni, Li-Fraumeni-like, and nonsyndromic predisposition with or without family history. To explore genotype/phenotype associations, we previously adopted a functional classification of all germline TP53 mutant alleles based on transactivation. Severe deficiency (SD) alleles were associated with more severe cancer proneness syndromes, and a larger number of tumors, compared with partial deficiency (PD) alleles. Because mutant p53 can exert dominant-negative (DN) effects, we addressed the relationship between DN and clinical manifestations. We reasoned that DN effects might be stronger in familial cancer cases associated with germline TP53 mutations, where mutant alleles coexist with the wild-type allele since conception. We examined 104 p53 mutant alleles with single amino acid substitutions described in the IARC germline database for (i) transactivation capability and (ii) capacity to reduce the activity of the wild-type allele (i.e., DN effect) using a quantitative yeast-based assay. The functional classifications of p53 alleles were then related to clinical variables. We confirmed that a classification based on transactivation alone can identify familial cancer cases with more severe clinical features. Classification based on DN effects allowed us to highlight similar associations but did not reveal distinct clinical subclasses of SD alleles, except for a correlation with tumor tissue prevalence. We conclude that in carriers of germline TP53 mutations transactivation-based classification of TP53 alleles appears more important for genotype/phenotype correlations than DN effects and that haplo-insufficiency of the TP53 gene is an important factor in cancer proneness in humans.",0,1,0
"Measurement of urinary CDH and CTH by tandem mass spectrometry in patients hemizygous and heterozygous for Fabry disease.  Fabry disease is an X-linked disorder of glycosphingolipid metabolism resulting from a deficiency of the lysosomal enzyme alpha-galactosidase A. This deficiency leads to the progressive accumulation, in lysosomes of visceral tissues and in body fluids of hemizygotes, of the glycosphingolipids globotriaosylceramide (CTH, Gb(3) or GL-3) and galabiosylceramide (CDH) and to a lesser extent the blood group AB and B related glycolipids. Elevated levels of the glycosphingolipids are found in the urine of hemizygous males with the classic phenotype, but it is not known whether all symptomatic or asymptomatic heterozygotes have elevated levels. We have therefore measured CTH and CDH quantitatively in a multiplex assay using tandem mass spectrometry in urine from a large cohort (44) of genetically proven or obligate heterozygotes including four with the N215S mutation, from classic hemizygotes (28), from cardiac variant hemizygotes with the N215S mutation (6) and from normal controls. The levels of CTH and CDH were related to both creatinine and sphingomyelin. Urinary CTH was elevated in all 28 classic hemizygotes but only in 4/6 of the cardiac variants. The level was within or just above the normal reference range in the four individuals heterozygous for the N215S mutation but was elevated in 38/40 of the other heterozygotes. Similar results were obtained for CDH, except that only 34/40 heterozygotes had an elevated level. The level of CDH was not elevated in the four heterozygotes and 4/6 of the hemizygotes for the N215S mutation. Combining the levels of CTH and CDH did not improve the discrimination of heterozygotes from controls. The ratio of CDH to CTH was higher in heterozygotes than in hemizygotes. Measurement of urinary CTH gave the best discrimination of heterozygotes from controls.",3 0,1,0
"Transcriptional control of SLC26A4 is involved in Pendred syndrome and nonsyndromic enlargement of vestibular aqueduct (DFNB4).  Although recessive mutations in the anion transporter gene SLC26A4 are known to be responsible for Pendred syndrome (PS) and nonsyndromic hearing loss associated with enlarged vestibular aqueduct (EVA), also known as ""DFNB4,"" a large percentage of patients with this phenotype lack mutations in the SLC26A4 coding region in one or both alleles. We have identified and characterized a key transcriptional regulatory element in the SLC26A4 promoter that binds FOXI1, a transcriptional activator of SLC26A4. In nine patients with PS or nonsyndromic EVA, a novel c.-103T-->C mutation in this regulatory element interferes with FOXI1 binding and completely abolishes FOXI1-mediated transcriptional activation. We have also identified six patients with mutations in FOXI1 that compromise its ability to activate SLC26A4 transcription. In one family, the EVA phenotype segregates in a double-heterozygous mode in the affected individual who carries single mutations in both SLC26A4 and FOXI1. This finding is consistent with our observation that EVA occurs in the Slc26a4(+/-); Foxi1(+/-) double-heterozygous mouse mutant. These results support a novel dosage-dependent model for the molecular pathogenesis of PS and nonsyndromic EVA that involves SLC26A4 and its transcriptional regulatory machinery.",1 0,1,0
"The alpha-galactosidase A p.Arg118Cys variant does not cause a Fabry disease phenotype: data from individual patients and family studies.  Lysosomal α-galactosidase A (α-Gal) is the enzyme deficient in Fabry disease (FD), an X-linked glycosphingolipidosis caused by pathogenic mutations affecting the GLA gene. The early-onset, multi-systemic FD classical phenotype is associated with absent or severe enzyme deficiency, as measured by in vitro assays, but patients with higher levels of residual α-Gal activity may have later-onset, more organ-restricted clinical presentations. A change in the codon 118 of the wild-type α-Gal sequence, replacing basic arginine by a potentially sulfhydryl-binding cysteine residue - GLA p.(Arg118Cys) -, has been recurrently described in large FD screening studies of high-risk patients. Although the Cys118 allele is associated with high residual α-Gal activity in vitro, it has been classified as a pathogenic mutation, mainly on the basis of theoretical arguments about the chemistry of the cysteine residue. However its pathogenicity has never been convincingly demonstrated by pathology criteria. We reviewed the clinical, biochemical and histopathology data obtained from 22 individuals of Portuguese and Spanish ancestry carrying the Cys118 allele, including 3 homozygous females. Cases were identified either on the differential diagnosis of possible FD manifestations and on case-finding studies (n=11; 4 males), or on unbiased cascade screening of probands' close relatives (n=11; 3 males). Overall, those data strongly suggest that the GLA p.(Arg118Cys) variant does not segregate with FD clinical phenotypes in a Mendelian fashion, but might be a modulator of the multifactorial risk of cerebrovascular disease. The Cys118 allelic frequency in healthy Portuguese adults (n=696) has been estimated as 0.001, therefore not qualifying for ""rare"" condition.",2 0 3,1,0
"A pathogenic role for germline PTEN variants which accumulate into the nucleus.  The PTEN gene encodes a master regulator protein that exerts essential functions both in the cytoplasm and in the nucleus. PTEN is mutated in the germline of both patients with heterogeneous tumor syndromic diseases, categorized as PTEN hamartoma tumor syndrome (PHTS), and a group affected with autism spectrum disorders (ASD). Previous studies have unveiled the functional heterogeneity of PTEN variants found in both patient cohorts, making functional studies necessary to provide mechanistic insights related to their pathogenicity. Here, we have functionally characterized a PTEN missense variant [c.49C>G; p.(Gln17Glu); Q17E] associated to both PHTS and ASD patients. The PTEN Q17E variant displayed partially reduced PIP3-catalytic activity and normal stability in cells, as shown using S. cerevisiae and mammalian cell experimental models. Remarkably, PTEN Q17E accumulated in the nucleus, in a process involving the PTEN N-terminal nuclear localization sequence. The analysis of additional germline-associated PTEN N-terminal variants illustrated the existence of a PTEN N-terminal region whose targeting in disease causes PTEN nuclear accumulation, in parallel with defects in PIP3-catalytic activity in cells. Our findings highlight the frequent occurrence of PTEN gene mutations targeting PTEN N-terminus whose pathogenicity may be related, at least in part, with the retention of PTEN in the nucleus. This could be important for the implementation of precision therapies for patients with alterations in the PTEN pathway.",0,1,0
