Abstract,Classification,true_label0,predicted_label0
"To die or not to die: how does p53 decide?  p53 is frequently mutated in cancer and as a result is one of the most intensely studied tumour suppressors. Analysis of the primitive forms of p53 found in Caenorhabditis elegans and Drosophila, alongside studies using transgenic mouse models, indicate that the induction of apoptosis is both the most conserved function of p53 and vital for tumour suppression. p53-mediated apoptosis occurs through a combination of mechanisms which include pathways that are both dependent and independent of alterations in gene expression. In response to genotoxic insult, these pathways probably act together, thereby amplifying the apoptotic signal. However, the picture is complicated because the p53 activity is determined by stress type and individual cellular characteristics. The numerous p53 responsive genes that have been identified also provide further means of controlling the actions of p53. The recent discoveries of proteins that interact with p53 and specifically regulate the ability of p53 to trigger apoptosis have provided further mechanistic insights into the role of p53 in inducing cell death. Understanding the molecular basis of the proapoptotic action of p53 can assist in our quest to reintroduce or reactivate p53 in human tumours.",0,1,0
"Tailor-Made Protein Tyrosine Phosphatases: In Vitro Site-Directed Mutagenesis of PTEN and PTPRZ-B.  In vitro site-directed mutagenesis (SDM) of protein tyrosine phosphatases (PTPs) is a commonly used approach to experimentally analyze PTP functions at the molecular and cellular level and to establish functional correlations with PTP alterations found in human disease. Here, using the tumor-suppressor PTEN and the receptor-type PTPRZ-B (short isoform from PTPRZ1 gene) phosphatases as examples, we provide a brief insight into the utility of specific mutations in the experimental analysis of PTP functions. We describe a standardized, rapid, and simple method of mutagenesis to perform single and multiple amino acid substitutions, as well as deletions of short nucleotide sequences, based on one-step inverse PCR and DpnI restriction enzyme treatment. This method of SDM is generally applicable to any other protein of interest.",0,1,0
"Molecular and functional characterization of eight novel GAA mutations in Italian infants with Pompe disease.  We characterized 29 unrelated patients presenting with the severe form of Pompe disease (Glycogen Storage Disease Type II, acid maltase deficiency) and identified 26 pathogenic mutations divided over 28 different genotypes. Among the eight new mutations, five were exonic point mutations (c.572A>G, c.1124G>T, c.1202A>G, c.1564C>G and c.1796C>A) leading to codon changes (p.Y191C, p.R375L, p.Q401R, p.P522A and p.S599Y); two were intronic point mutations (c.-32-3C>A and c.1636+5G>C) affecting mRNA processing; one was a single base deletion (c.742delC) generating a truncated protein (p.L248PfsX20). A comprehensive evaluation, based on different methodological approaches, confirmed the detrimental effect of the eight mutations on the protein and its function. Structural alterations potentially induced by the five missense mutations were also predicted through visual inspection of the atomic model of the GAA protein, in terms of both function and spatial orientation of specific residues as well as disturbance generated by amino acid substitutions. Although the remarkable heterogeneity of the mutational spectrum in Pompe disease was already known, our data demonstrate and confirm the power of molecular and functional analysis in predicting the natural course of Pompe disease.",1 4 0,1,0
"Functional analysis, using in vitro mutagenesis, of amino acids located in the phenylalanine hydroxylase active site.  The 3-dimensional structure determination of rat phenylalanine hydroxylase (PAH) has identified potentially important amino acids lining the active site cleft with the majority of these having hydrophobic side-chains including several with aromatic side chains. Here we have analyzed the effect on rat PAH enzyme kinetics of in vitro mutagenesis of a number of these amino acids lining the PAH active site. Mutation of F299, Y324, F331, and Y343 caused a significant decrease in enzyme activity but no change in the Km for substrate or cofactor. We conclude that these aromatic residues are essential for activity but are not significantly involved in binding of the substrate or cofactor. In contrast the PAH mutant, S349T, showed an 18-fold increase in Km for phenylalanine, showing the first functional evidence that this residue was binding at or near the phenylalanine binding site. This confirms the recently published model for the binding of phenylalanine to the PAH active site that postulated S349 interacts with the amino group on the main chain of the phenylalanine molecule. This result differs with that found for the equivalent mutation (S395T), in the closely related tyrosine hydroxylase, which had no effect on substrate Km, showing that while the architecture of the two active sites are very similar the amino acids that bind to the respective substrates are different.",0,1,0
"Mutation screen and RNA analysis disclose the changed splicing of the E-cadherin transcription in gastric cancer.  Gastric cancer (GC) is considered to be one of the leading cancers in East Asians, and mutations in the CDH1 gene and the reduced expression of E-cadherin are the most frequent genetic alterations in gastric cancer. In this paper, we reported two novel germline CDH1 nonsynonymous mutations, c.1296 C>G (N432 K) and c.1297 G>A (D433 N) detected in sporadic Chinese GC patients. RNA splicing analysis was used to evaluate mutations' effects on E-cadherin transcription and exon definition. We revealed that the c.1296 C>G (N432 K) variant can generate the E-cadherin exon9-skipping and may be a disease-causing mutation, while the c.1297 G>A (D433 N) mutation not. Moreover, we demonstrated the E-cadherin 1054del83 transcript is a frequent event in Chinese GC patients.",4 0,1,0
"A nonsense mutation in the acid α-glucosidase gene causes Pompe disease in Finnish and Swedish Lapphunds.  Pompe disease is a recessively inherited and often fatal disorder caused by the deficiency of acid α-glucosidase, an enzyme encoded by the GAA gene and needed to break down glycogen in lysosomes. This glycogen storage disease type II has been reported also in Swedish Lapphund dogs. Here we describe the genetic defect in canine Pompe disease and show that three related breeds from Scandinavia carry the same mutation. The affected dogs are homozygous for the GAA c.2237G>A mutation leading to a premature stop codon at amino acid position 746. The corresponding mutation has previously been reported in humans and causes infantile Pompe disease in combination with a second fully deleterious mutation. The affected dogs from both the Finnish as well as the Swedish breed mimic infantile-onset Pompe disease genetically, but also clinico-pathologically. Therefore this canine model provides a valuable tool for preclinical studies aimed at the development of gene therapy in Pompe disease.",0,1,0
"Molecular basis of gain-of-function LEOPARD syndrome-associated SHP2 mutations.  The Src homology 2 (SH2) domain-containing protein tyrosine phosphatase 2 (SHP2) is a critical signal transducer downstream of growth factors that promotes the activation of the RAS-ERK1/2 cascade. In its basal state, SHP2 exists in an autoinhibited closed conformation because of an intramolecular interaction between its N-SH2 and protein tyrosine phosphatase (PTP) domains. Binding to pTyr ligands present on growth factor receptors and adaptor proteins with its N-SH2 domain localizes SHP2 to its substrates and frees the active site from allosteric inhibition. Germline mutations in SHP2 are known to cause both Noonan syndrome (NS) and LEOPARD syndrome (LS), two clinically similar autosomal dominant developmental disorders. NS-associated SHP2 mutants display elevated phosphatase activity, while LS-associated SHP2 mutants exhibit reduced catalytic activity. A conundrum in how clinically similar diseases result from mutations to SHP2 that have opposite effects on this enzyme's catalytic functionality exists. Here we report a comprehensive investigation of the kinetic, structural, dynamic, and biochemical signaling properties of the wild type as well as all reported LS-associated SHP2 mutants. The results reveal that LS-causing mutations not only affect SHP2 phosphatase activity but also induce a weakening of the intramolecular interaction between the N-SH2 and PTP domains, leading to mutants that are more readily activated by competing pTyr ligands. Our data also indicate that the residual phosphatase activity associated with the LS SHP2 mutant is required for enhanced ERK1/2 activation. Consequently, catalytically impaired SHP2 mutants could display gain-of-function properties because of their ability to localize to the vicinity of substrates for longer periods of time, thereby affording the opportunity for prolonged substrate turnover and sustained RAS-ERK1/2 activation.",0,1,0
"Juvenile-onset glycogen storage disease type II with novel mutations in acid alpha-glucosidase gene.  The authors describe two novel mutations of the acid alpha-glucosidase gene, P361L and R437C, which define the juvenile-onset glycogen storage disease type II (GSDII) in a 16-year-old Chinese patient. The asymptomatic 13-year-old brother of the proband is also a compound heterozygote of the two mutations. These results confirm that intrafamilial phenotypic variation of juvenile-onset GSDII is ethnically diverse and suggest the contribution of other genes to the phenotypic variability of GSDII.",1 0,1,0
"p53 compound heterozygosity in a severely affected child with Li-Fraumeni syndrome.  The Li-Fraumeni Syndrome (LFS) is a rare, dominantly inherited syndrome that features high risk of cancers in childhood and early adulthood. Affected families tend to develop bone and soft tissue sarcomas, breast cancers, brain tumors, leukemias, and adrenocortical carcinomas. In some kindreds, the genetic abnormality associated with this cancer phenotype is a heterozygous germline mutation in the p53 tumor suppressor gene. Recently, we identified one patient who presented in early childhood with multiple primary cancers and who harbored three germline p53 alterations (R156H and R267Q on the maternal allele and R290H on the paternal allele). To classify the biologic effects of these alterations, functional properties of each of the p53 mutants were examined using in vitro assays of cellular growth suppression and transcriptional activation. Each amino acid substitution conferred partial or complete loss of wild-type p53 function, but the child completed normal embryonic development. This observation has not been previously reported in a human, but is consistent with observations of normal embryogenesis in p53-deficient mice.",2 4 0 3,1,0
"Functional effects of PTPN11 (SHP2) mutations causing LEOPARD syndrome on epidermal growth factor-induced phosphoinositide 3-kinase/AKT/glycogen synthase kinase 3beta signaling.  LEOPARD syndrome (LS), a disorder with multiple developmental abnormalities, is mainly due to mutations that impair the activity of the tyrosine phosphatase SHP2 (PTPN11). How these alterations cause the disease remains unknown. We report here that fibroblasts isolated from LS patients displayed stronger epidermal growth factor (EGF)-induced phosphorylation of both AKT and glycogen synthase kinase 3beta (GSK-3beta) than fibroblasts from control patients. Similar results were obtained in HEK293 cells expressing LS mutants of SHP2. We found that the GAB1/phosphoinositide 3-kinase (PI3K) complex was more abundant in fibroblasts from LS than control subjects and that both AKT and GSK-3beta hyperphosphorylation were prevented by reducing GAB1 expression or by overexpressing a GAB1 mutant unable to bind to PI3K. Consistently, purified recombinant LS mutants failed to dephosphorylate GAB1 PI3K-binding sites. These mutants induced PI3K-dependent increase in cell size in a model of chicken embryo cardiac explants and in transcriptional activity of the atrial natriuretic factor (ANF) gene in neonate rat cardiomyocytes. In conclusion, SHP2 mutations causing LS facilitate EGF-induced PI3K/AKT/GSK-3beta stimulation through impaired GAB1 dephosphorylation, resulting in deregulation of a novel signaling pathway that could be involved in LS pathology.",0,1,0
The PALB2 p.Leu939Trp mutation is not associated with breast cancer risk.  ,0,1,0
"KRAS insertion mutations are oncogenic and exhibit distinct functional properties.  Oncogenic KRAS mutations introduce discrete amino acid substitutions that reduce intrinsic Ras GTPase activity and confer resistance to GTPase-activating proteins (GAPs). Here we discover a partial duplication of the switch 2 domain of K-Ras encoding a tandem repeat of amino acids G60_A66dup in a child with an atypical myeloproliferative neoplasm. K-Ras proteins containing this tandem duplication or a similar five amino acid E62_A66dup mutation identified in lung and colon cancers transform the growth of primary myeloid progenitors and of Ba/F3 cells. Recombinant K-Ras(G60_A66dup) and K-Ras(E62_A66dup) proteins display reduced intrinsic GTP hydrolysis rates, accumulate in the GTP-bound conformation and are resistant to GAP-mediated GTP hydrolysis. Remarkably, K-Ras proteins with switch 2 insertions are impaired for PI3 kinase binding and Akt activation, and are hypersensitive to MEK inhibition. These studies illuminate a new class of oncogenic KRAS mutations and reveal unexpected plasticity in oncogenic Ras proteins that has diagnostic and therapeutic implications.",0,1,0
"A case of childhood Pompe disease demonstrating phenotypic variability of p.Asp645Asn.  A six-year-old child presented at 8 months of age with proximal muscle weakness and mild cardiac hypertrophy. Some alpha-glucosidase activity was detected in muscle but not in fibroblasts. As none of the two pathogenic mutations, [c.1933G>A]+[c.2702T>A] (Asp645Asn/Leu901Gln), led to detectable alpha-glucosidase activity upon expression in COS cells, the phenotype of the patient remained unexplained. A functionally comparable set of mutations, Asp645Asn/insGnt2243, was reported previously to cause classic infantile Pompe disease [Biochem Biophys Res Commun 244 (1998) 921]. We conclude that secondary genetic or environmental factors can be decisive for the phenotypic outcome of classic infantile versus childhood Pompe disease, when the acid alpha-glucosidase activity is extremely low.",1 0,1,0
"Caffeine and halothane sensitivity of intracellular Ca2+ release is altered by 15 calcium release channel (ryanodine receptor) mutations associated with malignant hyperthermia and/or central core disease.  Malignant hyperthermia (MH) and central core disease (CCD) are autosomal dominant disorders of skeletal muscle in which a potentially fatal hypermetabolic crisis can be triggered by commonly used anesthetic agents. To date, 17 mutations in the human RYR1 gene encoding the Ca2+ release channel of skeletal muscle sarcoplasmic reticulum (the ryanodine receptor) have been associated with MH and/or CCD. Although many of these mutations have been linked to MH and/or CCD, with high lod (log of the odds favoring linkage versus nonlinkage) scores, others have been found in single, small families. Independent biochemical evidence for a causal role for these mutations in MH is available for only two mutants. Mutations corresponding to the human MH mutations were made in a full-length rabbit RYR1 cDNA, and wild type and mutant cDNAs were transfected into HEK-293 cells. After about 48 h, intact cells were loaded with the fluorescent Ca2+ indicator, fura-2, and intracellular Ca2+ release, induced by caffeine or halothane, was measured by photometry. Ca2+ release in cells expressing MH or CCD mutant ryanodine receptors was invariably significantly more sensitive to low concentrations of caffeine and halothane than Ca2+ release in cells expressing wild type receptors or receptors mutated in other regions of the molecule. Linear regression analysis showed that there is a strong correlation (r = 0.95, p < 0.001) between caffeine sensitivity of different RYR1 mutants measured by the cellular Ca2+ photometry assay and by the clinical in vitro caffeine halothane contracture test (IVCT). The correlation was weaker, however, for halothane (r = 0.49, p > 0.05). Abnormal sensitivity in the Ca2+ photometry assay provides supporting evidence for a causal role in MH for each of 15 single amino acid mutations in the ryanodine receptor. The study demonstrates the usefulness of the cellular Ca2+ photometry assay in the assessment of the sensitivity to caffeine and halothane of specific ryanodine receptor mutants.",0,1,0
"Reduced phosphatase activity of SHP-2 in LEOPARD syndrome: consequences for PI3K binding on Gab1.  LEOPARD (LS) and Noonan (NS) are overlapping syndromes associated with distinct mutations of SHP-2. Whereas NS mutations enhance SHP-2 catalytic activity, we show that the activity of three representative LS mutants is undetectable when assayed using a standard protein tyrosine phosphatase (PTP) substrate. A different assay using a specific SHP-2 substrate confirms their decreased PTP activity, but also reveals a significant activity of the T468M mutant. In transfected cells stimulated with epidermal growth factor, the least active LS mutants promote Gab1/PI3K binding, validating our in vitro data. LS mutants thus display a reduced PTP activity both in vitro and in transfected cells.",0,1,0
"Perturbation of PALB2 function by the T413S mutation found in small cell lung cancer.  Background: Germline mutations in thePALB2 gene are associated with the genetic disorder Fanconi anaemia and increased predisposition to cancer. Disease-associated variants are mainly protein-truncating mutations, whereas a few missense substitutions are reported to perturb its interaction with breast cancer susceptibility proteins BRCA1 and BRCA2, which play essential roles in homology-directed repair (HDR). More recently, PALB2 was shown to associate with active genes independently of BRCA1, and through this mechanism, safeguards these regions from DNA replicative stresses. However, it is unknown whether PALB2 tumour suppressor function requires its chromatin association.Methods: Mining the public database of cancer mutations, we identified four potentially deleterious cancer-associated missense mutations within the PALB2 chromatin association motif (ChAM). To assess the impact of these mutations on PALB2 function, we generated cell lines expressing PALB2 variants harbouring corresponding ChAM mutations, and evaluated PALB2 chromatin association properties and the cellular resistance to camptothecin (CPT). Additionally, we examined the accumulation of γH2A.X and the RAD51 recombinase as readouts of DNA damage signalling and HDR, respectively.Results: We demonstrate that a small-cell lung cancer (SCLC)-associated T413S mutation in PALB2 impairs its chromatin association and confers reduced resistance to CPT, the only FDA-approved drug for relapsed SCLC. Unexpectedly, we found a less efficient γH2A.X nuclear foci formation in PALB2 T413S expressing cells, whereas a near-normal level of RAD51 nuclear foci was visible.Conclusions: These findings support the importance of PALB2 chromatin association in the suppression of tumours, including SCLC, an unusually aggressive type of cancer with poor prognosis. PALB2 T413S has little impact on RAD51 recruitment, likely due to its intact interaction with BRCA1 and BRCA2. However, this mutant shows inefficient DNA stress signalling. This finding sheds new light on the function of PALB2, playing a role in efficient DNA stress signalling through constitutive chromatin association.",0,1,0
"P-TEN, the tumor suppressor from human chromosome 10q23, is a dual-specificity phosphatase.  Protein tyrosine phosphatases (PTPs) have long been thought to play a role in tumor suppression due to their ability to antagonize the growth promoting protein tyrosine kinases. Recently, a candidate tumor suppressor from 10q23, termed P-TEN, was isolated, and sequence homology was demonstrated with members of the PTP family, as well as the cytoskeletal protein tensin. Here we show that recombinant P-TEN dephosphorylated protein and peptide substrates phosphorylated on serine, threonine, and tyrosine residues, indicating that P-TEN is a dual-specificity phosphatase. In addition, P-TEN exhibited a high degree of substrate specificity, showing selectivity for extremely acidic substrates in vitro. Furthermore, we demonstrate that mutations in P-TEN, identified from primary tumors, tumor cells lines, and a patient with Bannayan-Zonana syndrome, resulted in the ablation of phosphatase activity, demonstrating that enzymatic activity of P-TEN is necessary for its ability to function as a tumor suppressor.",0,1,0
"A silent mutation induces exon skipping in the phenylalanine hydroxylase gene in phenylketonuria.  An A-->T substitution in cDNA nucleotide 1197 (c.1197A/T) of the human phenylalanine hydroxylase (PAH) gene has been regarded as a silent mutation, because both the wild-type (GUA) and the mutant (GUU) alleles encode a valine residue at codon 399 (V399 V). The nucleotide c.1197 is located at the 3'-end of exon 11at position -3 of the exon-intron junction. To explore whether the substitution exerts any effects on the processing of the PAH mRNA, illegitimate PAH transcripts from lymphoblast cultures of a phenylketonuria (PKU) patient heterozygous for c.1197A/T were analyzed by the polymerase chain reaction following reverse-transcription (RT-PCR). mRNAs with an exon 11 deletion were revealed. Furthermore, by using an R408 W mutation in the paternal allele as a marker, sequence analysis of the RT-PCR products indicates that virtually all PAH transcripts from the maternal allele with the c. 1197A/T substitution do not contain exon 11. To address whether this substitution is the main determinant for exon skipping, PAH minigenes with or without the substitution were constructed and transfected to a human hepatoma cell line. Analysis of the transcription products by S1 nuclease mapping clearly indicated that such exon 11 skipping was directly associated with the c.1197A/T substitution. Thus, this study demonstrates that the c.1197A/T substitution in the PAH gene is not just a neutral polymorphism but a mutation that induces post-transcriptional skipping of exon 11 leading to a PKU phenotype.",3 1 0,1,0
"Solution structure of the sixth LDL-A module of the LDL receptor.  The low-density lipoprotein receptor (LDLR) is the primary mechanism for uptake of plasma cholesterol into cells and serves as a prototype for an entire class of cell surface receptors. The amino-terminal domain of the receptor consists of seven LDL-A modules; the third through the seventh modules all contribute to the binding of low-density lipoproteins (LDLs). Here, we present the NMR solution structure of the sixth LDL-A module (LR6) from the ligand binding domain of the LDLR. This module, which has little recognizable secondary structure, retains the essential structural features observed in the crystal structure of LDL-A module five (LR5) of the LDLR. Three disulfide bonds, a pair of buried residues forming a hydrophobic ""mini-core"", and a calcium-binding site that serves to organize the C-terminal lobe of the module all occupy positions in LR6 similar to those observed in LR5. The striking presence of a conserved patch of negative surface electrostatic potential among LDL-A modules of known structure suggests that ligand recognition by these repeats is likely to be mediated in part by electrostatic complementarity of receptor and ligand. Two variants of LR6, identified originally as familial hypercholesterolemia (FH) mutations, have been investigated for their ability to form native disulfide bonds under conditions that permit disulfide exchange. The first, E219K, lies near the amino-terminal end of LR6, whereas the second, D245E, alters one of the aspartate side chains that directly coordinate the bound calcium ion. After equilibration at physiologic calcium concentrations, neither E219K nor D245E folds to a unique disulfide isomer, indicating that FH mutations both within and distant from the calcium-binding site give rise to protein-folding defects.",0,1,0
"Cleft lip/palate and CDH1/E-cadherin mutations in families with hereditary diffuse gastric cancer.  We report the association of CDH1/E-cadherin mutations with cleft lip, with or without cleft palate (CLP), in two families with hereditary diffuse gastric cancer (HDGC). In each family, the CDH1 mutation was a splicing mutation generating aberrant transcripts with an in-frame deletion, removing the extracellular cadherin repeat domains involved in cell-cell adhesion. Such transcripts might encode mutant proteins with trans-dominant negative effects. We found that CDH1 is highly expressed at 4 and 5 weeks in the frontonasal prominence, and at 6 weeks in the lateral and medial nasal prominences of human embryos, and is therefore expressed during the critical stages of lip and palate development. These findings suggest that alteration of the E-cadherin pathway can contribute to human clefting.",3 4 0,1,0
Synthesis of the Rheb and K-Ras4B GTPases.  ,0,1,0
Identification and molecular characterization of a novel 3&#x2032; mutation in RUNX1 in a family with familial platelet disorder.  ,4 0,1,0
